ECSS Source Reference,ID,RequirementText,_class_,Context
ECSS_E_ST_40C,ECSS-E-ST-40_0860059,supplier shall transform requirement software item architecture describe toplevel structure identifies software component ensure requirement software item allocate software component later refine facilitate detailed design cover minimum hierarchy dependency interface operational usage software component document process data control aspects product describes architecture static decomposition software element package class unit describe dynamic architecture involve identification active object thread task process describe software behaviour,PM,  context_task_E context_component_E context_unit_E context_structure_E context_interface_E context_operational_ECSS_E_ST_40C context_software_ECSS_E_ST_40C context_software_component_ECSS_E_ST_40C context_software_item_ECSS_E_ST_40C context_package_E context_process_ECSS context_design_ECSS context_element_ECSS context_product_ECSS context_requirement_ECSS context_supplier_ECSS context_static_E 
ECSS_E_ST_40C,ECSS-E-ST-40_0860060,supplier shall use method eg object orient functional produce static dynamic architecture include software element interface software element relationship,PM,  context_interface_E context_software_ECSS_E_ST_40C context_element_ECSS context_supplier_ECSS context_static_E 
ECSS_E_ST_40C,ECSS-E-ST-40_0860061,dynamic architecture design shall describe accord analysable computational model,PM,  context_model_E context_design_ECSS 
ECSS_E_ST_40C,ECSS-E-ST-40_0860062,software architecture design shall also describe behaviour software mean description technique use automaton scenario,PM,  context_software_ECSS_E_ST_40C context_design_ECSS 
ECSS_E_ST_40C,ECSS-E-ST-40_0860063,supplier shall develop document software preliminary design interface external software item software component software item,PM,  context_component_E context_interface_E context_software_ECSS_E_ST_40C context_software_component_ECSS_E_ST_40C context_software_item_ECSS_E_ST_40C context_design_ECSS context_supplier_ECSS 
ECSS_E_ST_40C,ECSS-E-ST-40_0860064,supplier shall define procedure method tool reuse apply software engineering process comply reusability requirement software development,PM,  context_procedure_E context_reusability_ECSS_E_ST_40C context_software_ECSS_E_ST_40C context_process_ECSS context_development_ECSS context_requirement_ECSS context_supplier_ECSS 
ECSS_E_ST_40C,ECSS-E-ST-40_0860065,evaluation reuse potential software shall perform pdr cdr,PM, context_PDR_ECSS_E_ST_40C  context_software_ECSS_E_ST_40C 
ECSS_E_ST_40C,ECSS-E-ST-40_0860066,supplier shall design software mission configuration dependant data separate eg database,PM,  context_mission_E context_software_ECSS_E_ST_40C context_configuration_E context_design_ECSS context_supplier_ECSS 
ECSS_E_ST_40C,ECSS-E-ST-40_0860067,analysis potential reusability exist software component shall perform identification reuse component model respect functional requirement baseline quality evaluation component apply ecssqst clause,PM,  context_component_E context_reusability_ECSS_E_ST_40C context_software_ECSS_E_ST_40C context_software_component_ECSS_E_ST_40C context_model_E context_analysis_E context_baseline_ECSS context_quality_ECSS context_requirement_ECSS 
ECSS_E_ST_40C,ECSS-E-ST-40_0860068,supplier shall define document preliminary software integration strategy term responsibility schedule control procedures test approach goal achieve sequence environment criterion,PM,  context_environment_E context_software_ECSS_E_ST_40C context_schedule_E context_integration_E context_supplier_ECSS context_test_E 
ECSS_E_ST_40C,ECSS-E-ST-40_0860069,supplier shall conduct preliminary design review pdr accordance clause note successful completion review establishes baseline development software item,PM,  context_software_ECSS_E_ST_40C context_software_item_ECSS_E_ST_40C context_baseline_ECSS context_design_ECSS context_development_ECSS context_review_ECSS context_supplier_ECSS 
ECSS_E_ST_40C,ECSS-E-ST-40_0860070,supplier shall develop detailed design component software document,PM,  context_component_E context_software_ECSS_E_ST_40C context_design_ECSS context_supplier_ECSS 
ECSS_E_ST_40C,ECSS-E-ST-40_0860208,ss shall describe product perspective related system,V, context_SSS_E  context_system_E context_product_ECSS 
ECSS_E_ST_40C,ECSS-E-ST-40_0860209,product replace exist system system shall describe reference,V,  context_system_E context_reference_E context_product_ECSS 
ECSS_E_ST_40C,ECSS-E-ST-40_0860210,ss shall describe main capability support software note reference state mode system make,V, context_SSS_E  context_system_E context_software_ECSS_E_ST_40C context_mode_E context_capability_E context_reference_E 
ECSS_E_ST_40C,ECSS-E-ST-40_0860211,ss shall describe item limit supplier option design develop software,V, context_SSS_E  context_software_ECSS_E_ST_40C context_design_ECSS context_supplier_ECSS 
ECSS_E_ST_40C,ECSS-E-ST-40_0860212,ss shall describe software operational environment,V, context_SSS_E  context_environment_E context_operational_ECSS_E_ST_40C context_software_ECSS_E_ST_40C 
ECSS_E_ST_40C,ECSS-E-ST-40_0860216,reference interface requirement document define external interface system shall provide,V,  context_interface_E context_system_E context_external_interface_E context_interface_requirement_document_E context_reference_E context_requirement_ECSS 
ECSS_E_ST_40C,ECSS-E-ST-40_0860217,computer infrastructure use shall also describe,V,  
ECSS_E_ST_40C,ECSS-E-ST-40_0860218,ss shall list make reference exist assumption specific requirement base note risk analysis use identify assumption prove valid note constraint requirement example specify interface system exist note production system occur expect system specification change note follow provision apply system specific requirement list ss specify,V, context_SSS_E  context_constraint_E context_specification_E context_interface_E context_system_E context_reference_E context_analysis_E context_provision_ECSS context_requirement_ECSS context_risk_ECSS 
ECSS_E_ST_40C,ECSS-E-ST-40_0860219,requirement shall uniquely identify,M,  context_requirement_ECSS 
ECSS_E_ST_40C,ECSS-E-ST-40_0860220,requirement express model supplier shall establish way assign identifier within model sake traceability,M,  context_model_E context_requirement_ECSS context_supplier_ECSS context_traceability_ECSS 
ECSS_E_ST_40C,ECSS-E-ST-40_0860221,requirement shall associate validation method version per ecssqst,M,  context_validation_ECSS_E_ST_40C context_requirement_ECSS 
ECSS_E_ST_40C,ECSS-E-ST-40_0860222,ss shall list requirement specify system behaviour associate performance,V, context_SSS_E  context_system_E context_performance_ECSS context_requirement_ECSS 
ECSS_E_ST_40C,ECSS-E-ST-40_0860223,description capability requirement shall organize capability type note example requirement organize per control subsystem eg aocs power thermal,M, context_For_E  context_subsystem_E context_capability_E context_requirement_ECSS 
ECSS_E_ST_40C,ECSS-E-ST-40_0860224,capability requirement shall include realtime behaviour constraint system f,M,  context_constraint_E context_system_E context_capability_E context_requirement_ECSS 
ECSS_E_ST_40C,ECSS-E-ST-40_0860225,hmi capability requirement shall result human factor engineering process describe ecssest,M, context_HMI_ECSS_E_ST_40C  context_capability_E context_process_ECSS context_requirement_ECSS 
ECSS_E_ST_40C,ECSS-E-ST-40_0860226,ss shall state capability implement onboard control procedure obcp,V, context_SSS_E  context_procedure_E context_capability_E 
ECSS_E_ST_40C,ECSS-E-ST-40_0860227,ss shall list refer ird interface requirement impose system,V, context_SSS_E  context_interface_E context_system_E context_requirement_ECSS 
ECSS_E_ST_40C,ECSS-E-ST-40_0860228,requirement follow shall either list ss refer ird communication interface hardware interface software interface hmi,M, context_SSS_E  context_interface_E context_software_ECSS_E_ST_40C context_requirement_ECSS 
ECSS_E_ST_40C,ECSS-E-ST-40_0860229,ss shall list data vary accord operational need sitedependant data include system database,V, context_SSS_E  context_need_E context_system_E context_operational_ECSS_E_ST_40C 
ECSS_E_ST_40C,ECSS-E-ST-40_0860230,ss shall list requirement computer hardware use,V, context_SSS_E  context_requirement_ECSS 
ECSS_E_ST_40C,ECSS-E-ST-40_0860231,ss shall list requirement computer resource utilization eg processor capacity memory capacity available software item eg size timing,V, context_SSS_E  context_software_ECSS_E_ST_40C context_software_item_ECSS_E_ST_40C context_memory_E context_resource_E context_requirement_ECSS 
ECSS_E_ST_40C,ECSS-E-ST-40_0860232,ss shall list requirement software item use incorporated system constituent software product eg specific real time operate system,V, context_SSS_E  context_system_E context_software_ECSS_E_ST_40C context_software_item_ECSS_E_ST_40C context_product_ECSS context_requirement_ECSS 
ECSS_E_ST_40C,ECSS-E-ST-40_0860233,ss shall list security requirement applicable system,V, context_SSS_E  context_system_E context_requirement_ECSS context_security_ECSS 
ECSS_E_ST_40C,ECSS-E-ST-40_0860234,ss shall list safety requirement applicable system,V, context_SSS_E  context_system_E context_requirement_ECSS context_safety_ECSS 
ECSS_E_ST_40C,ECSS-E-ST-40_0860235,ss shall list reliability availability requirement applicable system,V, context_SSS_E  context_system_E context_availability_ECSS context_reliability_ECSS context_requirement_ECSS 
ECSS_E_ST_40C,ECSS-E-ST-40_0860236,ss shall list quality requirement applicable software eg usability reusability portability applicable software development standard note future reuse develop software component requirement customer specifies generic application domain component example include requirement software architecture give target computer operate system interface require reuse level reuse require eg function subsystem code unit,V, context_SSS_E  context_function_E context_component_E context_unit_E context_interface_E context_system_E context_portability_ECSS_E_ST_40C context_reusability_ECSS_E_ST_40C context_software_ECSS_E_ST_40C context_software_component_ECSS_E_ST_40C context_usability_ECSS_E_ST_40C context_target_E context_customer_ECSS context_development_ECSS context_quality_ECSS context_requirement_ECSS context_standard_ECSS 
ECSS_E_ST_40C,ECSS-E-ST-40_0860237,ss shall include requirement constraint design production system note software integrated system customer check applicability harmonization constraint specification operate system use specification cot use eg database hmi generator specification sde use,V, context_COTS_ECSS_E_ST_40C context_HMI_ECSS_E_ST_40C context_SDE_ECSS_E_ST_40C context_SSS_E  context_constraint_E context_specification_E context_system_E context_software_ECSS_E_ST_40C context_customer_ECSS context_design_ECSS context_requirement_ECSS 
ECSS_E_ST_40C,ECSS-E-ST-40_0860238,least follow type requirement shall consider constraint software architecture utilization standard utilization exist component utilization customer furnish component cot component note instance database use produce automatically configure software eg generation table constant data initial value note instance database accord ecssest ecssest eg missionoperations database operational database ground element space segment database spacecraft database utilization design standard utilization data standard utilization specific program language utilization specific name convention flexibility expansion utilization hmi standard,V, context_COTS_ECSS_E_ST_40C context_HMI_ECSS_E_ST_40C context_For_E  context_constraint_E context_component_E context_spacecraft_E context_operational_ECSS_E_ST_40C context_software_ECSS_E_ST_40C context_flexibility_E context_segment_E context_value_E context_customer_ECSS context_design_ECSS context_element_ECSS context_requirement_ECSS context_space_segment_ECSS context_standard_ECSS 
ECSS_E_ST_40C,ECSS-E-ST-40_0860239,ss shall include system requirement operation software note supplier response provide release operational plan execution establish clause,V, context_SSS_E  context_operation_E context_response_E context_system_E context_operational_ECSS_E_ST_40C context_software_ECSS_E_ST_40C context_requirement_ECSS context_supplier_ECSS 
ECSS_E_ST_40C,ECSS-E-ST-40_0860240,ss shall include system requirement maintenance software include system requirement flight modification capability note supplier response agree customer system requirement review srr intend release maintenance plan execution establish clause note due long lifetime often encountered flight software special requirement also exist ensure support tool eg compiler engineering tool inflight modification tool support inorbit reprogramming specify lifetime,V, context_SSS_E  context_response_E context_system_E context_software_ECSS_E_ST_40C context_capability_E context_customer_ECSS context_lifetime_ECSS context_maintenance_ECSS context_requirement_ECSS context_review_ECSS context_supplier_ECSS 
ECSS_E_ST_40C,ECSS-E-ST-40_0860241,ss shall include system software requirement observability system note observability requirement impair performance requirement eg computer throughput bandwidth ground exploitation rate telecommands impact specify observability requirement eg consider need oversampling note case acg capability code generator automatically instrument code remove code part cover observability requirement consider,V, context_SSS_E  context_need_E context_impact_E context_system_E context_software_ECSS_E_ST_40C context_observability_E context_capability_E context_part_ECSS context_performance_ECSS context_requirement_ECSS 
ECSS_E_ST_40C,ECSS-E-ST-40_0860242,ss shall include requirement need plan set system verification validation process relate software note specific customer requirement eg availability usage customer furnish equipment like etm em fm relate ground system need order plan set system level verification validation process relate software furthermore important define test mission phase mission increment far applicable usage hardwaresoftware simulator representative flight ground environment system payloads experiment pre integration test hardwaresoftware compatibility well acceptance test,V, context_FM_E context_SSS_E  context_environment_E context_mission_E context_need_E context_compatibility_E context_system_E context_software_ECSS_E_ST_40C context_validation_ECSS_E_ST_40C context_verification_ECSS_E_ST_40C context_ground_system_E context_acceptance_test_E context_simulator_E context_process_ECSS context_acceptance_ECSS context_availability_ECSS context_customer_ECSS context_equipment_ECSS context_integration_E context_requirement_ECSS context_test_E context_mission_phase_E 
ECSS_E_ST_40C,ECSS-E-ST-40_0860243,ss shall include requirement validation software requirement baseline technical specification particular mission representative data scenario operational procedure use,V, context_SSS_E  context_mission_E context_specification_E context_procedure_E context_operational_ECSS_E_ST_40C context_software_ECSS_E_ST_40C context_validation_ECSS_E_ST_40C context_baseline_ECSS context_requirement_ECSS 
ECSS_E_ST_40C,ECSS-E-ST-40_0860244,ss shall describe validation requirement specify support demonstration software requirement meet,V, context_SSS_E  context_software_ECSS_E_ST_40C context_validation_ECSS_E_ST_40C context_requirement_ECSS 
ECSS_E_ST_40C,ECSS-E-ST-40_0860245,identify requirement b validation method shall include,M, context_For_E  context_validation_ECSS_E_ST_40C context_requirement_ECSS 
ECSS_E_ST_40C,ECSS-E-ST-40_0860247,ss shall include requirement installation acceptance software need version content medium need supplier support system integration format delivery medium exchange data project include interface system database,V, context_SSS_E  context_need_E context_interface_E context_system_E context_software_ECSS_E_ST_40C context_acceptance_ECSS context_integration_E context_project_ECSS context_requirement_ECSS context_supplier_ECSS context_support_system_ECSS 
ECSS_E_ST_40C,ECSS-E-ST-40_0860249,ird shall contain description purpose objective content reason prompt preparation,V, context_IRD_ECSS_E_ST_40C  
ECSS_E_ST_40C,ECSS-E-ST-40_0860252,ird shall describe product external interface system,V, context_IRD_ECSS_E_ST_40C  context_interface_E context_system_E context_external_interface_E context_product_ECSS 
ECSS_E_ST_40C,ECSS-E-ST-40_0860253,ird shall describe item limit supplier option design develop interface software,V, context_IRD_ECSS_E_ST_40C  context_interface_E context_software_ECSS_E_ST_40C context_design_ECSS context_supplier_ECSS 
ECSS_E_ST_40C,ECSS-E-ST-40_0860258,ird shall list make reference exist assumption dependency,V, context_IRD_ECSS_E_ST_40C  context_reference_E 
ECSS_E_ST_40C,ECSS-E-ST-40_0860259,requirement shall uniquely identify,M,  context_requirement_ECSS 
ECSS_E_ST_40C,ECSS-E-ST-40_0860260,ird shall list external interface requirement specify interface behaviour associate performance,V, context_IRD_ECSS_E_ST_40C  context_interface_E context_external_interface_E context_performance_ECSS context_requirement_ECSS 
ECSS_E_ST_40C,ECSS-E-ST-40_0860261,ird shall define interface requirement impose system system level interface requirement softwarehardware interface system level data interface communication interface hardware interface software interface hmi,V, context_IRD_ECSS_E_ST_40C  context_interface_E context_system_E context_software_ECSS_E_ST_40C context_requirement_ECSS 
ECSS_E_ST_40C,ECSS-E-ST-40_0860262,ird shall list external data vary accord operational need sitedependant data,V, context_IRD_ECSS_E_ST_40C  context_need_E context_operational_ECSS_E_ST_40C 
ECSS_E_ST_40C,ECSS-E-ST-40_0860263,ird shall describe necessary validation requirement specify support demonstration software requirement meet,V, context_IRD_ECSS_E_ST_40C  context_software_ECSS_E_ST_40C context_validation_ECSS_E_ST_40C context_requirement_ECSS 
ECSS_E_ST_40C,ECSS-E-ST-40_0860264,identify requirement validation method shall include,M, context_For_E  context_validation_ECSS_E_ST_40C context_requirement_ECSS 
ECSS_E_ST_40C,ECSS-E-ST-40_0860267,sr shall list applicable reference document support generation document,V, context_SRS_E  context_reference_E 
ECSS_E_ST_40C,ECSS-E-ST-40_0860269,sr shall describe purpose product,V, context_SRS_E  context_product_ECSS 
ECSS_E_ST_40C,ECSS-E-ST-40_0860270,sr shall summarize physical environment target system hardware environment target system operate environment target system,V, context_SRS_E  context_environment_E context_system_E context_target_E 
ECSS_E_ST_40C,ECSS-E-ST-40_0860271,sr shall describe detail product relationship system,V, context_SRS_E  context_system_E context_product_ECSS 
ECSS_E_ST_40C,ECSS-E-ST-40_0860272,product component integrate hwsw product sr shall summarize essential characteristic larger product list hw sw component software interface summarize computer hardware peripheral equipment use,V, context_HW_ECSS_E_ST_40C context_SW_ECSS_E_ST_40C context_SRS_E  context_component_E context_interface_E context_software_ECSS_E_ST_40C context_equipment_ECSS context_product_ECSS 
ECSS_E_ST_40C,ECSS-E-ST-40_0860276,requirement shall uniquely identify,M,  context_requirement_ECSS 
ECSS_E_ST_40C,ECSS-E-ST-40_0860277,requirement express model supplier shall establish way assign identifier within model sake traceability,M,  context_model_E context_requirement_ECSS context_supplier_ECSS context_traceability_ECSS 
ECSS_E_ST_40C,ECSS-E-ST-40_0860278,traceability information requirement derive higher level documentation applicable higher level requirement shall state note document trace provide automatically tool model use express requirement,M,  context_model_E context_requirement_ECSS context_traceability_ECSS 
ECSS_E_ST_40C,ECSS-E-ST-40_0860280,sr shall describe capability provide software item definition,V, context_SRS_E  context_software_ECSS_E_ST_40C context_software_item_ECSS_E_ST_40C context_capability_E 
ECSS_E_ST_40C,ECSS-E-ST-40_0860281,sr shall provide applicable link requirement system state mode,V, context_SRS_E  context_system_E context_mode_E context_link_E context_requirement_ECSS 
ECSS_E_ST_40C,ECSS-E-ST-40_0860282,functional requirement shall group subject accordance logical model organization eg per control subsystem,V,  context_subsystem_E context_logical_model_ECSS_E_ST_40C context_model_E context_requirement_ECSS 
ECSS_E_ST_40C,ECSS-E-ST-40_0860284,sr shall describe functional requirement relate software safety dependability,V, context_SRS_E  context_software_ECSS_E_ST_40C context_dependability_ECSS context_requirement_ECSS context_safety_ECSS 
ECSS_E_ST_40C,ECSS-E-ST-40_0860285,sr shall list specific requirement specify performance software item definition,V, context_SRS_E  context_software_ECSS_E_ST_40C context_software_item_ECSS_E_ST_40C context_performance_ECSS context_requirement_ECSS 
ECSS_E_ST_40C,ECSS-E-ST-40_0860286,sr shall list describe reference icd software item external interface,V, context_SRS_E  context_interface_E context_software_ECSS_E_ST_40C context_software_item_ECSS_E_ST_40C context_external_interface_E context_reference_E 
ECSS_E_ST_40C,ECSS-E-ST-40_0860290,sr shall list specific requirement related operation software intend environment,V, context_SRS_E  context_environment_E context_operation_E context_software_ECSS_E_ST_40C context_requirement_ECSS 
ECSS_E_ST_40C,ECSS-E-ST-40_0860293,sr shall describe resource requirement related software hardware requirement target hardware software specify operate follow list requirement relevant hardware environment software specify operate list size timing requirement applicable software item specification description computer software use software specification incorporate software item eg operating system software item reuse description real time constraint respect eg time management respect handle input data loss validity,V, context_SRS_E  context_constraint_E context_environment_E context_specification_E context_system_E context_software_ECSS_E_ST_40C context_software_item_ECSS_E_ST_40C context_target_E context_resource_E context_validity_E context_requirement_ECSS 
ECSS_E_ST_40C,ECSS-E-ST-40_0860294,sr shall list requirement drive design software item specification identify implementation constraint,V, context_SRS_E  context_constraint_E context_specification_E context_software_ECSS_E_ST_40C context_software_item_ECSS_E_ST_40C context_design_ECSS context_requirement_ECSS 
ECSS_E_ST_40C,ECSS-E-ST-40_0860295,requirement applicable follow item shall include software standard eg applicable coding standard development standard design requirement specific design method apply minimize number critical software component see ecssqst requirement relevant numerical accuracy management design requirement relevant inflight modification software item specific design requirement apply software specify design intend reuse specific constraint induce reused software eg cot free software open source,V,  context_constraint_E context_component_E context_critical_software_ECSS_E_ST_40C context_software_ECSS_E_ST_40C context_software_component_ECSS_E_ST_40C context_software_item_ECSS_E_ST_40C context_accuracy_E context_coding_E context_source_E context_critical_E context_design_ECSS context_development_ECSS context_requirement_ECSS context_standard_ECSS 
ECSS_E_ST_40C,ECSS-E-ST-40_0860296,sr shall describe security privacy requirement applicable software item,V, context_SRS_E  context_software_ECSS_E_ST_40C context_software_item_ECSS_E_ST_40C context_requirement_ECSS context_security_ECSS 
ECSS_E_ST_40C,ECSS-E-ST-40_0860297,sr shall list portability requirement applicable software item,V, context_SRS_E  context_portability_ECSS_E_ST_40C context_software_ECSS_E_ST_40C context_software_item_ECSS_E_ST_40C context_requirement_ECSS 
ECSS_E_ST_40C,ECSS-E-ST-40_0860298,sr shall list quality requirement applicable software item,V, context_SRS_E  context_software_ECSS_E_ST_40C context_software_item_ECSS_E_ST_40C context_quality_ECSS context_requirement_ECSS 
ECSS_E_ST_40C,ECSS-E-ST-40_0860299,sr shall list reliability requirement applicable software item,V, context_SRS_E  context_software_ECSS_E_ST_40C context_software_item_ECSS_E_ST_40C context_reliability_ECSS context_requirement_ECSS 
ECSS_E_ST_40C,ECSS-E-ST-40_0860300,sr shall list maintainability requirement applicable software item,V, context_SRS_E  context_software_ECSS_E_ST_40C context_software_item_ECSS_E_ST_40C context_maintainability_ECSS context_requirement_ECSS 
ECSS_E_ST_40C,ECSS-E-ST-40_0860301,sr shall list safety requirement applicable software item,V, context_SRS_E  context_software_ECSS_E_ST_40C context_software_item_ECSS_E_ST_40C context_requirement_ECSS context_safety_ECSS 
ECSS_E_ST_40C,ECSS-E-ST-40_0860302,sr shall list requirement applicable select delivery medium software configuration applicable software item,V, context_SRS_E  context_software_ECSS_E_ST_40C context_software_item_ECSS_E_ST_40C context_configuration_E context_requirement_ECSS 
ECSS_E_ST_40C,ECSS-E-ST-40_0860303,sr shall list requirement relate specific data format structure exchange system database requirement allow take account eg flight software mission product specific constraint,V, context_SRS_E  context_constraint_E context_mission_E context_structure_E context_system_E context_software_ECSS_E_ST_40C context_product_ECSS context_requirement_ECSS 
