ECSS Source Reference,ID,RequirementText,_class_,Context
ECSS_E_ST_10CRev1,ECSS-E-ST-10_0790251,specification tree document shall provide complete list specification define system product contain graphical representation system product specification ie top level tree decompose lower level product specification,V,  context_specification_E context_system_E context_product_ECSS 
ECSS_E_ST_10CRev1,ECSS-E-ST-10_0790252,recurrent product previous space project use specification shall identify tree structure addition every necessary product supplier responsibility specification shall identify tree structure,V,  context_specification_E context_structure_E context_product_ECSS context_project_ECSS context_supplier_ECSS 
ECSS_E_ST_10CRev1,ECSS-E-ST-10_0790314,rtm shall include follow technical requirement specification define ecssest annex product lower level element product tree define ecssmst annex b specification tree define ecssest annex j,V, context_RTM_ECSS_E_ST_10CRev1  context_specification_E context_element_ECSS context_product_ECSS context_product_tree_ECSS context_requirement_ECSS context_technical_requirement_E 
ECSS_E_ST_10CRev1,ECSS-E-ST-10_0790315,rtm shall list technical requirement product t,V, context_RTM_ECSS_E_ST_10CRev1 context_TS_ECSS_E_ST_10CRev1  context_product_ECSS context_requirement_ECSS context_technical_requirement_E 
ECSS_E_ST_10CRev1,ECSS-E-ST-10_0790316,rtm shall list lower level element constitute product technical requirement contain lowerlevel element t,V, context_RTM_ECSS_E_ST_10CRev1  context_element_ECSS context_product_ECSS context_requirement_ECSS context_technical_requirement_E 
ECSS_E_ST_10CRev1,ECSS-E-ST-10_0790317,requirement identification shall identical rtm different t,V, context_RTM_ECSS_E_ST_10CRev1 context_TS_ECSS_E_ST_10CRev1  context_requirement_ECSS 
ECSS_E_ST_10CRev1,ECSS-E-ST-10_0790318,technical requirement product shall link least one requirement lower level element,M,  context_link_E context_element_ECSS context_product_ECSS context_requirement_ECSS context_technical_requirement_E 
ECSS_E_ST_10CRev1,ECSS-E-ST-10_0790320,technical requirement lower level element link technical requirement product requirement shall justify evaluation existence removal product shall agree customer supplier,M,  context_link_E context_customer_ECSS context_element_ECSS context_product_ECSS context_requirement_ECSS context_supplier_ECSS context_technical_requirement_E 
ECSS_E_ST_10CRev1,ECSS-E-ST-10_0790323,rjf shall include reference technical requirement specification,V, context_RJF_ECSS_E_ST_10CRev1  context_specification_E context_reference_E context_requirement_ECSS context_technical_requirement_E 
ECSS_E_ST_10CRev1,ECSS-E-ST-10_0790327,rjf shall list technical requirement identifier express corresponding t organize document,V, context_RJF_ECSS_E_ST_10CRev1 context_TS_ECSS_E_ST_10CRev1  context_requirement_ECSS context_technical_requirement_E 
ECSS_E_ST_10CRev1,ECSS-E-ST-10_0790328,technical requirement follow information shall provide justification requirement ie justify source entity owner responsible requirement one technical requirement induce several source reason specify performance justification quantify performance range approach use determine level eg measure estimation justification select verification method,M, context_For_E  context_verification_E context_entity_E context_source_E context_performance_ECSS context_requirement_ECSS context_technical_requirement_E 
ECSS_E_ST_10CRev1,ECSS-E-ST-10_0790329,rjf shall present requirement traceability technical requirement ts justified source,V, context_RJF_ECSS_E_ST_10CRev1  context_requirement_traceability_ECSS_E_ST_10CRev1 context_source_E context_requirement_ECSS context_traceability_ECSS context_technical_requirement_E 
ECSS_E_ST_10CRev1,ECSS-E-ST-10_0790405,technical requirement lower level element link technical requirement product,M,  context_link_E context_element_ECSS context_product_ECSS context_requirement_ECSS context_technical_requirement_E 
ECSS_E_ST_10_06C,ECSS-E-ST-10-06_0770001,technical requirement shall formulate defined clause,M,  context_requirement_ECSS context_technical_requirement_E 
ECSS_E_ST_10_06C,ECSS-E-ST-10-06_0770002,specification shall identifiable referable relate product system,V,  context_specification_ECSS_E_ST_10_06C context_system_E context_product_ECSS 
ECSS_E_ST_10_06C,ECSS-E-ST-10-06_0770005,technical requirement shall group,V,  context_requirement_ECSS context_technical_requirement_E 
ECSS_E_ST_10_06C,ECSS-E-ST-10-06_0770006,technical requirement shall separately state,V,  context_requirement_ECSS context_technical_requirement_E 
ECSS_E_ST_10_06C,ECSS-E-ST-10-06_0770007,abbreviate term use requirement shall define dedicated section specification,V,  context_specification_ECSS_E_ST_10_06C context_requirement_ECSS 
ECSS_E_ST_10_06C,ECSS-E-ST-10-06_0770008,technical requirement shall consistent eg conflict requirement within specification,V,  context_specification_ECSS_E_ST_10_06C context_requirement_ECSS context_technical_requirement_E 
ECSS_E_ST_10_06C,ECSS-E-ST-10-06_0770009,technical requirement shall conflict requirement contain business agreement document,V,  context_business_agreement_ECSS context_requirement_ECSS context_agreement_E context_technical_requirement_E 
ECSS_E_ST_10_06C,ECSS-E-ST-10-06_0770010,specification shall complete term applicable requirement reference applicable document,V,  context_specification_ECSS_E_ST_10_06C context_reference_E context_applicable_document_ECSS context_requirement_ECSS 
ECSS_E_ST_10_06C,ECSS-E-ST-10-06_0770011,technical requirement shall call one technical requirement applicable refer document,M,  context_requirement_ECSS context_technical_requirement_E 
ECSS_E_ST_10_06C,ECSS-E-ST-10-06_0770012,link applicable document shall state technical requirement,M,  context_link_E context_applicable_document_ECSS context_requirement_ECSS context_technical_requirement_E 
ECSS_E_ST_10_06C,ECSS-E-ST-10-06_0770013,reference number applicable document cite specification shall contain revision identifier,V,  context_specification_ECSS_E_ST_10_06C context_reference_E context_applicable_document_ECSS 
ECSS_E_ST_10_06C,ECSS-E-ST-10-06_0770014,specification shall configuration management,V,  context_specification_ECSS_E_ST_10_06C context_configuration_E context_configuration_management_ECSS 
ECSS_E_ST_10_06C,ECSS-E-ST-10-06_0770015,specification shall establish readily exchange accord established access policy right,V,  context_specification_ECSS_E_ST_10_06C 
ECSS_E_ST_10_06C,ECSS-E-ST-10-06_0770016,clause state informative descriptive clause shall contain requirement recommendation,V,  context_informative_ECSS context_requirement_ECSS 
ECSS_E_ST_10_06C,ECSS-E-ST-10-06_0770017,technical requirement specification shall include technical requirement exclude requirement cost method payment quantity require time place delivery,V,  context_specification_ECSS_E_ST_10_06C context_requirement_ECSS context_technical_requirement_E 
ECSS_E_ST_10_06C,ECSS-E-ST-10-06_0770018,technical requirement shall describe quantifiable term,M,  context_requirement_ECSS context_technical_requirement_E 
ECSS_E_ST_10_06C,ECSS-E-ST-10-06_0770019,necessary remove possible ambiguity give performance requirement method use determine require performance shall indicate requirement,M,  context_performance_ECSS context_requirement_ECSS 
ECSS_E_ST_10_06C,ECSS-E-ST-10-06_0770021,entity responsible technical requirement shall identify,M,  context_entity_E context_requirement_ECSS context_technical_requirement_E 
ECSS_E_ST_10_06C,ECSS-E-ST-10-06_0770023,technical requirement shall configuration management,M,  context_configuration_E context_configuration_management_ECSS context_requirement_ECSS context_technical_requirement_E 
ECSS_E_ST_10_06C,ECSS-E-ST-10-06_0770024,technical requirement shall backwardstraceable,M,  context_requirement_ECSS context_technical_requirement_E 
ECSS_E_ST_10_06C,ECSS-E-ST-10-06_0770025,technical requirement shall forwardtraceable,M,  context_requirement_ECSS context_technical_requirement_E 
ECSS_E_ST_10_06C,ECSS-E-ST-10-06_0770026,technical requirement shall unambiguous,M,  context_requirement_ECSS context_technical_requirement_E 
ECSS_E_ST_10_06C,ECSS-E-ST-10-06_0770027,technical requirement shall unique,M,  context_requirement_ECSS context_technical_requirement_E 
ECSS_E_ST_10_06C,ECSS-E-ST-10-06_0770028,technical requirement shall identify relation relevant function product system,M,  context_function_ECSS_E_ST_10_06C context_system_E context_product_ECSS context_requirement_ECSS context_technical_requirement_E 
ECSS_E_ST_10_06C,ECSS-E-ST-10-06_0770029,unique identifier shall assign technical requirement,M,  context_requirement_ECSS context_technical_requirement_E 
ECSS_E_ST_10_06C,ECSS-E-ST-10-06_0770032,technical requirement shall separately state,M,  context_requirement_ECSS context_technical_requirement_E 
ECSS_E_ST_10_06C,ECSS-E-ST-10-06_0770033,technical requirement shall selfcontained,M,  context_requirement_ECSS context_technical_requirement_E 
ECSS_E_ST_10_06C,ECSS-E-ST-10-06_0770034,technical requirement shall verifiable use one approve verification method,M,  context_verification_E context_requirement_ECSS context_technical_requirement_E 
ECSS_E_ST_10_06C,ECSS-E-ST-10-06_0770039,verbal form shall shall use whenever provision requirement,M,  context_provision_ECSS context_requirement_ECSS 
ECSS_E_ST_10_06C,ECSS-E-ST-10-06_0770040,verbal form shall use whenever provision recommendation,M,  context_provision_ECSS 
ECSS_E_ST_10_06C,ECSS-E-ST-10-06_0770041,verbal form may shall use whenever provision permission,M,  context_provision_ECSS 
ECSS_E_ST_10_06C,ECSS-E-ST-10-06_0770042,verbal form shall use indicate possibility capability,M,  context_capability_E 
ECSS_E_ST_10_06C,ECSS-E-ST-10-06_0770043,list term shall use ts requirement andor etc goal shall include limited relevant necessary appropriate far possible optimize minimize maximize typical rapid userfriendly easy sufficient enough suitable satisfactory adequate quick first rate best possible great small large state art,M, context_TS_ECSS_E_ST_10_06C  context_requirement_ECSS 
ECSS_E_ST_10_06C,ECSS-E-ST-10-06_0770045,t shall list applicable reference document support generation document,V, context_TS_ECSS_E_ST_10_06C  context_reference_E 
ECSS_E_ST_10_06C,ECSS-E-ST-10-06_0770046,t shall present main element characterize user need develop product background requirement define detail dedicate section,V, context_TS_ECSS_E_ST_10_06C  context_need_ECSS_E_ST_10_06C context_user_E context_element_ECSS context_product_ECSS context_requirement_ECSS 
ECSS_E_ST_10_06C,ECSS-E-ST-10-06_0770047,t shall put product perspective related product,V, context_TS_ECSS_E_ST_10_06C  context_product_ECSS 
ECSS_E_ST_10_06C,ECSS-E-ST-10-06_0770049,t defines product component higher tier system t shall recall related need larger system shall describe identify interface system product,V, context_TS_ECSS_E_ST_10_06C  context_need_ECSS_E_ST_10_06C context_component_E context_interface_E context_system_E context_product_ECSS 
ECSS_E_ST_10_06C,ECSS-E-ST-10-06_0770050,technical specification shall describe concept expect product architecture function principle base,V,  context_function_ECSS_E_ST_10_06C context_specification_ECSS_E_ST_10_06C context_product_ECSS 
ECSS_E_ST_10_06C,ECSS-E-ST-10-06_0770051,t shall list describe different chronological situation product life profile,V, context_TS_ECSS_E_ST_10_06C  context_life_profile_ECSS context_product_ECSS 
ECSS_E_ST_10_06C,ECSS-E-ST-10-06_0770052,t shall describe different environment constraint situation life profile product expect encounter,V, context_TS_ECSS_E_ST_10_06C  context_constraint_ECSS_E_ST_10_06C context_environment_ECSS_E_ST_10_06C context_life_profile_ECSS context_product_ECSS 
ECSS_E_ST_10_06C,ECSS-E-ST-10-06_0770053,t shall list technical requirement necessary product satisfy user need,V, context_TS_ECSS_E_ST_10_06C  context_need_ECSS_E_ST_10_06C context_user_E context_product_ECSS context_requirement_ECSS context_technical_requirement_E 
ECSS_E_ST_10_06C,ECSS-E-ST-10-06_0770054,technical requirement shall express accord ecssest clause,M,  context_requirement_ECSS context_technical_requirement_E 
ECSS_E_ST_10_06C,ECSS-E-ST-10-06_0770055,technical requirement justify,M,  context_requirement_ECSS context_technical_requirement_E 
ECSS_E_ST_10_06C,ECSS-E-ST-10-06_0770056,unique identifier reflect type technical requirement,M,  context_requirement_ECSS context_technical_requirement_E 
ECSS_E_ST_10_06C,ECSS-E-ST-10-06_0770057,unique identifier reflect life profile situation,M,  context_life_profile_ECSS 
ECSS_E_ST_10_06C,ECSS-E-ST-10-06_0770058,technical requirement state performance whatisnecessary term oppose tell supplier perform task unless exact step performance task essential ensure proper function product,M,  context_function_ECSS_E_ST_10_06C context_task_E context_step_E context_performance_ECSS context_product_ECSS context_requirement_ECSS context_supplier_ECSS context_technical_requirement_E 
ECSS_E_ST_10_06C,ECSS-E-ST-10-06_0770059,technical requirement express positive way complete sentence verb noun,M,  context_requirement_ECSS context_technical_requirement_E 
ECSS_E_ST_10_06C,ECSS-E-ST-10-06_0770060,product independent totally selfcontained ie able match final user need state,V,  context_need_ECSS_E_ST_10_06C context_user_E context_product_ECSS 
ECSS_E_ST_10_24C,ECSS-E-ST-10-24_1290039,ird shall define physical functional procedural operational interface requirement two item product tree ensure hardware software compatibility,V, context_IRD_ECSS_E_ST_10_24C  context_compatibility_E context_interface_E context_operational_E context_software_E context_product_ECSS context_product_tree_ECSS context_requirement_ECSS 
ECSS_E_ST_10_24C,ECSS-E-ST-10-24_1290040,interface requirement shall specify accordance ecssest,M,  context_interface_E context_requirement_ECSS 
ECSS_E_ST_10_24C,ECSS-E-ST-10-24_1290041,interface requirement shall accompany verification requirement,M,  context_interface_E context_verification_E context_requirement_ECSS 
ECSS_E_ST_10_24C,ECSS-E-ST-10-24_1290042,verification requirement define ac verification responsibility shall define,M, context_For_E  context_verification_E context_requirement_ECSS 
ECSS_E_ST_10_24C,ECSS-E-ST-10-24_1290045,case exist interface end design interface requirement shall address interface plane definition interface behaviour definition data affect interface definition,M,  context_interface_E context_interface_end_ECSS_E_ST_10_24C context_interface_plane_ECSS_E_ST_10_24C context_design_ECSS context_requirement_ECSS 
ECSS_E_ST_10_24C,ECSS-E-ST-10-24_1290046,addition general requirement define ecssest interface requirement applicability interface end shall specify,M,  context_interface_E context_interface_end_ECSS_E_ST_10_24C context_requirement_ECSS 
ECSS_E_ST_10_24C,ECSS-E-ST-10-24_1290047,case ird address one interface interface requirement shall group either interface end pair nature interface contractual party,V, context_IRD_ECSS_E_ST_10_24C  context_interface_E context_interface_end_ECSS_E_ST_10_24C context_requirement_ECSS 
ECSS_E_ST_10_24C,ECSS-E-ST-10-24_1290049,interface requirement shall build start reference interface data list annex e add data necessary specify interface,M,  context_interface_E context_reference_E context_requirement_ECSS 
ECSS_E_ST_20_08C,ECSS-E-ST-20-08_0090001,follow physical property component material shall measure coefficient thermal expansion heat conductivity specific heat young modulus poissons ratio flex strength note objective establish boundary qualification test program full range application mean analysis,NF,  context_component_E context_qualification_test_E context_property_E context_analysis_E context_material_ECSS context_qualification_ECSS context_test_E 
ECSS_E_ST_20_08C,ECSS-E-ST-20-08_0090002,data specify requirement shall determine development phase new component need repeat qualification program,NF,  context_need_E context_component_E context_development_ECSS context_qualification_ECSS context_requirement_ECSS 
ECSS_E_ST_20_08C,ECSS-E-ST-20-08_0090003,atmospheric condition inspection test operation storage shall follow pressure hpa temperature c average relative humidity note pressure hpa equivalent mmhg,NF,  context_operation_E context_condition_E context_inspection_E context_test_E 
ECSS_E_ST_20_08C,ECSS-E-ST-20-08_0090005,every deviation requirement b test shall record data documentation package ddp note ddp complete content refer annex g note semiconductor device ie planar diode shortcircuit special precaution take long storage period certain atmospheric condition chlorine content combination illumination produce metal contact migration semiconductor device,NF, context_DDP_E context_For_E  context_condition_E context_migration_E context_device_E context_package_E context_deviation_ECSS context_requirement_ECSS context_test_E 
ECSS_E_ST_20_08C,ECSS-E-ST-20-08_0090006,accuracy instrument test equipment use control measure test parameter shall one order magnitude higher tolerance variable measured note example achieve include measurement electrical performance temperature,NF,  context_test_equipment_E context_accuracy_E context_parameter_E context_equipment_ECSS context_performance_ECSS context_test_E context_tolerance_E 
ECSS_E_ST_20_08C,ECSS-E-ST-20-08_0090007,instrumentation use qualification acceptance test shall calibrate within specified calibration period time test,NF,  context_acceptance_test_ECSS_E_ST_20_08C context_calibration_E context_acceptance_ECSS context_qualification_ECSS context_test_E 
ECSS_E_ST_20_08C,ECSS-E-ST-20-08_0090008,instrumentation whose calibration period run plan test time shall use,NF,  context_calibration_E context_test_E 
ECSS_E_ST_20_08C,ECSS-E-ST-20-08_0090009,maximum test temperature tolerance thermal test shall give table,NF,  context_test_E context_tolerance_E 
ECSS_E_ST_20_08C,ECSS-E-ST-20-08_0090010,accuracy mass measurement shall better g whichever higher,NF,  context_accuracy_E 
ECSS_E_ST_20_08C,ECSS-E-ST-20-08_0090011,test condition tolerance shall apply nominal test value specify,NF,  context_condition_E context_value_E context_test_E context_tolerance_E 
ECSS_E_ST_20_08C,ECSS-E-ST-20-08_0090012,accuracy electrical performance test pva level shall better equal calibration loss factor use power analysis,NF, context_PVA_ECSS_E_ST_20_08C  context_accuracy_E context_calibration_E context_performance_test_E context_analysis_E context_performance_ECSS context_test_E 
ECSS_E_ST_20_08C,ECSS-E-ST-20-08_0090018,condition method test shall conform photovoltaic assembly source control draw scdpva note pva specification consist two part generic specification standard scd preparation scdpva refer annex,NF, context_PVA_ECSS_E_ST_20_08C context_For_E  context_specification_E context_condition_E context_photovoltaic_assembly_ECSS_E_ST_20_08C context_source_E context_assembly_E context_part_ECSS context_standard_ECSS context_test_E 
ECSS_E_ST_20_08C,ECSS-E-ST-20-08_0090019,scdpva shall prepare supplier conformance annex provide customer reviewing agreement,NF,  context_conformance_ECSS context_customer_ECSS context_supplier_ECSS context_agreement_E 
ECSS_E_ST_20_08C,ECSS-E-ST-20-08_0090020,deviation inprocess acceptance qualification test shall justify,NF,  context_qualification_test_E context_acceptance_ECSS context_deviation_ECSS context_qualification_ECSS context_test_E 
ECSS_E_ST_20_08C,ECSS-E-ST-20-08_0090022,flight hardware shall construct space qualify material follow property recover mass loss rml le note see ecssqst collect volatile condensable material cvcm le heated vacuum c collect c,NF,  context_property_E context_vacuum_E context_material_ECSS 
ECSS_E_ST_20_08C,ECSS-E-ST-20-08_0090024,material use construction pva dangerous health personnel shall identify,NF, context_PVA_ECSS_E_ST_20_08C  context_material_ECSS 
ECSS_E_ST_20_08C,ECSS-E-ST-20-08_0090025,preventive handling measure shall take conformance standard approve customer,NF,  context_conformance_ECSS context_customer_ECSS context_standard_ECSS 
ECSS_E_ST_20_08C,ECSS-E-ST-20-08_0090026,flammable material use construction pva shall identify,NF, context_PVA_ECSS_E_ST_20_08C  context_material_ECSS 
ECSS_E_ST_20_08C,ECSS-E-ST-20-08_0090027,supplier customer shall agree measure take prevent corrosion storage normal operational service,NF,  context_corrosion_E context_operational_E context_service_E context_customer_ECSS context_supplier_ECSS 
ECSS_E_ST_20_08C,ECSS-E-ST-20-08_0090029,avoid electrolytic corrosion process approve customer shall use,NF,  context_corrosion_E context_process_ECSS context_customer_ECSS 
ECSS_E_ST_20_08C,ECSS-E-ST-20-08_0090030,permanent magnetic material shall avoid specify mission,NF,  context_mission_E context_material_ECSS 
ECSS_E_ST_20_08C,ECSS-E-ST-20-08_0090032,pva material shall capable tolerating define erosion level result spacecraft operation without degradation nominal performance pva conformance pva specification note example thruster plume,NF, context_PVA_ECSS_E_ST_20_08C  context_specification_E context_operation_E context_spacecraft_E context_thruster_E context_conformance_ECSS context_material_ECSS context_performance_ECSS 
ECSS_E_ST_20_08C,ECSS-E-ST-20-08_0090033,pva material shall capable tolerating define level degradation result atox environment without degradation nominal performance pva conformance solar array specification,NF, context_ATOX_ECSS_E_ST_20_08C context_PVA_ECSS_E_ST_20_08C  context_environment_E context_specification_E context_conformance_ECSS context_material_ECSS context_performance_ECSS context_solar_array_ECSS 
ECSS_E_ST_20_08C,ECSS-E-ST-20-08_0090250,qualification test solar cell assembly scas shall comprises acceptance qualification test,NF,  context_qualification_test_E context_solar_cell_assembly_ECSS_E_ST_20_08C context_assembly_E context_acceptance_ECSS context_qualification_ECSS context_solar_cell_ECSS context_test_E 
ECSS_E_ST_20_08C,ECSS-E-ST-20-08_0090251,test previously qualify scas shall comprise acceptance test delta qualification test conformance requirement f,NF,  context_qualification_test_E context_acceptance_test_ECSS_E_ST_20_08C context_delta_qualification_ECSS_E_ST_20_08C context_acceptance_ECSS context_conformance_ECSS context_qualification_ECSS context_requirement_ECSS context_test_E 
ECSS_E_ST_20_08C,ECSS-E-ST-20-08_0090252,condition method test shall conform sca source control draw scdsca note sca specification consist two part generic specification standard scdsca preparation scdsca refer annex b,NF, context_SCA_ECSS_E_ST_20_08C context_For_E  context_specification_E context_condition_E context_source_E context_part_ECSS context_standard_ECSS context_test_E 
ECSS_E_ST_20_08C,ECSS-E-ST-20-08_0090253,scdsca shall prepare supplier conformance annex b provide customer reviewing agreement,NF,  context_conformance_ECSS context_customer_ECSS context_supplier_ECSS context_agreement_E 
ECSS_E_ST_20_08C,ECSS-E-ST-20-08_0090254,deviation require inprocess acceptance qualification test shall justify documentation package,NF,  context_qualification_test_E context_package_E context_acceptance_ECSS context_deviation_ECSS context_qualification_ECSS context_test_E 
ECSS_E_ST_20_08C,ECSS-E-ST-20-08_0090255,deviation standard applicable scdsca shall agree customer supplier affect reliability performance scas specify requirement c,NF,  context_customer_ECSS context_deviation_ECSS context_performance_ECSS context_reliability_ECSS context_requirement_ECSS context_standard_ECSS context_supplier_ECSS 
ECSS_E_ST_20_08C,ECSS-E-ST-20-08_0090256,deliver solar cell assembly shall produce inspected conformance requirement process identification document pid define clause,NF,  context_solar_cell_assembly_ECSS_E_ST_20_08C context_assembly_E context_process_ECSS context_conformance_ECSS context_requirement_ECSS context_solar_cell_ECSS 
ECSS_E_ST_20_08C,ECSS-E-ST-20-08_0090257,deliver solar cell assembly shall complete test inspection include scdsca,NF,  context_solar_cell_assembly_ECSS_E_ST_20_08C context_assembly_E context_inspection_E context_solar_cell_ECSS context_test_E 
ECSS_E_ST_20_08C,ECSS-E-ST-20-08_0090258,deliver solar cell assembly shall permanently mark code enable traceability cell level state pid note pid see clause,NF, context_For_E  context_solar_cell_assembly_ECSS_E_ST_20_08C context_mark_ECSS_E_ST_20_08C context_assembly_E context_solar_cell_ECSS context_traceability_ECSS 
ECSS_E_ST_20_08C,ECSS-E-ST-20-08_0090261,acceptance test shall perform follow component delivery component use qualification,NF,  context_component_E context_acceptance_test_ECSS_E_ST_20_08C context_acceptance_ECSS context_qualification_ECSS context_test_E 
ECSS_E_ST_20_08C,ECSS-E-ST-20-08_0090262,acceptance test shall consist follow visual inspection scas conformance clause dimension weight inspection scas conformance clause electrical performance measurement scas conformance clause diode characterization scas conformance clause,NF,  context_acceptance_test_ECSS_E_ST_20_08C context_acceptance_ECSS context_conformance_ECSS context_inspection_E context_performance_ECSS context_test_E 
ECSS_E_ST_20_08C,ECSS-E-ST-20-08_0090265,electrical current sca sc shall measure operational voltage iop solar cell temperature c operate temperature,NF, context_SC_ECSS_E_ST_20_08C context_SCA_ECSS_E_ST_20_08C  context_operational_E context_current_E context_solar_cell_ECSS 
ECSS_E_ST_20_08C,ECSS-E-ST-20-08_0090266,predict operational voltage vop shall define scdsca,NF,  context_operational_E 
ECSS_E_ST_20_08C,ECSS-E-ST-20-08_0090267,accuracy iop vop shall provide customer,NF, context_Iop_ECSS_E_ST_20_08C context_Vop_ECSS_E_ST_20_08C  context_accuracy_E context_customer_ECSS 
ECSS_E_ST_20_08C,ECSS-E-ST-20-08_0090268,measurement scas shall keep constant temperature,NF,  
