ECSS Source Reference,ID,RequirementText,_class_,Context
ECSS_E_ST_60_30C,ECSS-E-ST-60-30_1160001,aocs shall provide hardware software capability performances perform attitude measurement estimation guidance control need mission perform orbit control manoeuvre specify mission requirement ensure safe state spacecraft time include emergency anomaly situation accord failure management requirement ensure mission availability specify satellite level,F, context_AOCS_ECSS_E_ST_60_30C  context_mission_E context_need_E context_failure_E context_spacecraft_E context_software_E context_safe_state_E context_capability_E context_safe_E context_anomaly_ECSS context_availability_ECSS context_emergency_ECSS context_requirement_ECSS 
ECSS_E_ST_60_30C,ECSS-E-ST-60-30_1160002,aocs shall provide phase mission capability acquire keep attitude necessary perform mission,F, context_AOCS_ECSS_E_ST_60_30C  context_mission_E context_capability_E 
ECSS_E_ST_60_30C,ECSS-E-ST-60-30_1160003,aocs mode use initial acquisition shall provide capability transition initial attitude rate launcher separation final mission point safe orderly sequence,F, context_AOCS_ECSS_E_ST_60_30C  context_mission_E context_aocs_mode_ECSS_E_ST_60_30C context_mode_E context_capability_E context_safe_E context_launcher_ECSS 
ECSS_E_ST_60_30C,ECSS-E-ST-60-30_1160004,aocs shall provide specify mission requirement hardware software mean autonomous onboard attitude determination,F, context_AOCS_ECSS_E_ST_60_30C  context_mission_E context_software_E context_requirement_ECSS 
ECSS_E_ST_60_30C,ECSS-E-ST-60-30_1160005,navigation function necessary mission aocs shall provide hardware software mean autonomous onboard determination spacecraft orbital state include position velocity time,F, context_AOCS_ECSS_E_ST_60_30C  context_function_E context_mission_E context_spacecraft_E context_software_E 
ECSS_E_ST_60_30C,ECSS-E-ST-60-30_1160006,aocs shall identify define unambiguously reference frame need attitude measurement attitude control attitude guidance orbit navigation,F, context_AOCS_ECSS_E_ST_60_30C  context_need_E context_frame_E context_reference_E 
ECSS_E_ST_60_30C,ECSS-E-ST-60-30_1160007,aocs shall ensure attitude guidance point specify mission requirement mission operational phase meet,F, context_AOCS_ECSS_E_ST_60_30C  context_mission_E context_operational_E context_requirement_ECSS 
ECSS_E_ST_60_30C,ECSS-E-ST-60-30_1160008,aocs shall provide capability achieve orbit control manoeuvre specify mission analysis,F, context_AOCS_ECSS_E_ST_60_30C  context_mission_E context_capability_E context_analysis_E 
ECSS_E_ST_60_30C,ECSS-E-ST-60-30_1160009,case major anomaly aocs shall provide autonomous capability reach control safe point attitude angular rate ensure integrity spacecraft vital function include power thermal communication,F, context_AOCS_ECSS_E_ST_60_30C  context_function_E context_spacecraft_E context_vital_function_E context_capability_E context_angular_rate_E context_safe_E context_anomaly_ECSS 
ECSS_E_ST_60_30C,ECSS-E-ST-60-30_1160010,entry safe mode shall commandable ground tc,F, context_TC_ECSS_E_ST_60_30C  context_mode_E context_safe_E 
ECSS_E_ST_60_30C,ECSS-E-ST-60-30_1160011,return safe mode shall commandable ground tc,F, context_TC_ECSS_E_ST_60_30C  context_mode_E context_safe_E 
ECSS_E_ST_60_30C,ECSS-E-ST-60-30_1160012,aocs shall define strategy implementation mode transition describe strategy apply aocs mode transition include follow item transition condition check perform onboard software action software hardware perform autonomously board action perform ground,F, context_AOCS_ECSS_E_ST_60_30C  context_condition_E context_software_E context_aocs_mode_ECSS_E_ST_60_30C context_mode_E context_mode_transition_E 
ECSS_E_ST_60_30C,ECSS-E-ST-60-30_1160013,transition mode shall trigger one follow mechanism tc ground request time tagged auto autonomously board check transition condition fdir failure detection,F,  context_failure_E context_condition_E context_request_E context_mode_E context_mechanism_E 
ECSS_E_ST_60_30C,ECSS-E-ST-60-30_1160014,capability shall provide inhibit force auto fdir transition tc,F, context_FDIR_ECSS_E_ST_60_30C context_TC_ECSS_E_ST_60_30C  context_capability_E context_inhibit_ECSS 
ECSS_E_ST_60_30C,ECSS-E-ST-60-30_1160015,aocs shall provide capability perform endoflife disposal,F, context_AOCS_ECSS_E_ST_60_30C  context_capability_E context_disposal_ECSS 
ECSS_E_ST_60_30C,ECSS-E-ST-60-30_1160019,aocs shall process deliver frequency specify mission attitude orbit related information onboard function,NF, context_AOCS_ECSS_E_ST_60_30C  context_function_E context_mission_E context_process_ECSS 
ECSS_E_ST_60_30C,ECSS-E-ST-60-30_1160020,aocs design shall meet calibration constraint mission payload need,NF, context_AOCS_ECSS_E_ST_60_30C  context_constraint_E context_mission_E context_need_E context_calibration_E context_design_ECSS context_payload_ECSS 
ECSS_E_ST_60_30C,ECSS-E-ST-60-30_1160025,aocs shall provide satellite fdir purpose failure monitor parameter observe aocs unit derive aocs embed algorithm,F, context_AOCS_ECSS_E_ST_60_30C  context_unit_E context_failure_E context_parameter_E 
ECSS_E_ST_60_30C,ECSS-E-ST-60-30_1160026,aocs shall implement action aocs unit aocs mode require satellite fdir case anomaly,F, context_AOCS_ECSS_E_ST_60_30C context_FDIR_ECSS_E_ST_60_30C  context_unit_E context_aocs_mode_ECSS_E_ST_60_30C context_mode_E context_anomaly_ECSS 
ECSS_E_ST_60_30C,ECSS-E-ST-60-30_1160028,aocs software shall provide capability disable enable ground command autonomous aocs fdir monitor action function modify ground command parameter fdir monitoring action,F, context_AOCS_ECSS_E_ST_60_30C context_FDIR_ECSS_E_ST_60_30C  context_function_E context_software_E context_command_E context_parameter_E context_capability_E 
ECSS_E_ST_60_30C,ECSS-E-ST-60-30_1160033,aocs shall contribute estimation remain propellant quantity onboard onground algorithm measurement provide propulsion system cover mission need,F, context_AOCS_ECSS_E_ST_60_30C  context_mission_E context_need_E context_propellant_E context_propulsion_system_E context_system_E 
ECSS_E_ST_60_30C,ECSS-E-ST-60-30_1160034,aocs shall quantify mission phase include endoflife disposal amount propellant able perform propulsion size,F, context_AOCS_ECSS_E_ST_60_30C  context_mission_E context_propellant_E context_disposal_ECSS context_mission_phase_E 
ECSS_E_ST_60_30C,ECSS-E-ST-60-30_1160035,aocs shall identify every propulsionbased aocs mode number pulse command thruster associate pulse profile total impulse,F, context_AOCS_ECSS_E_ST_60_30C  context_total_impulse_E context_aocs_mode_ECSS_E_ST_60_30C context_command_E context_mode_E context_thruster_E 
ECSS_E_ST_60_30C,ECSS-E-ST-60-30_1160037,modification periodically updated aocs parameter shall implement dedicated tc,F, context_AOCS_ECSS_E_ST_60_30C  context_parameter_E 
ECSS_E_ST_70_01C,ECSS-E-ST-70-01_1060074,obcp engine shall able perform follow operation obcps response request telecommand ground system onboard process load ie request obcp engine load obcp obcp engine transition store engine inactive note ecsse service subtype activate ie request obcp engine initiate execution obcp transition inactive active run note ecsse service subtype communicate parameter ie request obcp engine communicate parameter active obcp note ecsse service subtype suspend ie request obcp engine suspend execution run obcp end current statement end specify step transition active run active hold note ecsse service subtype resume ie request obcp engine resume suspend obcp point suspend transition active hold active running note ecsse service subtype stop ie request obcp engine stop execution run obcp end current statement end specify step hold obcp transition active inactive note ecsse service subtype note execution obcp resume subsequently point abort ie request obcp engine stop immediately execution active obcp transition active inactive note ecsse service subtype delete ie request obcp engine remove inactive obcp obcp engine transition inactive store note ecsse service subtype,F, context_OBCP_ECSS_E_ST_70_01C  context_operation_E context_response_E context_system_E context_request_E context_obcp_engine_ECSS_E_ST_70_01C context_parameter_E context_ground_system_E context_statement_E context_step_E context_service_E context_current_E context_telecommand_E context_process_ECSS 
ECSS_E_ST_70_01C,ECSS-E-ST-70-01_1060075,obcp engine receive request consistent current state obcp shall fail request generate telecommand verification failure note example activate request already active obcp,F, context_OBCP_ECSS_E_ST_70_01C context_For_E  context_failure_E context_verification_E context_request_E context_obcp_engine_ECSS_E_ST_70_01C context_current_E context_telecommand_E 
ECSS_E_ST_70_01C,ECSS-E-ST-70-01_1060076,end execution obcp shall return autonomously inactive state transition completion,F, context_OBCP_ECSS_E_ST_70_01C  
ECSS_E_ST_70_01C,ECSS-E-ST-70-01_1060077,activate request shall include necessary parameter pass obcp,F, context_OBCP_ECSS_E_ST_70_01C  context_request_E context_parameter_E 
ECSS_E_ST_70_01C,ECSS-E-ST-70-01_1060079,execution obcp request load delete activate communicate parameter obcp stop suspend resume abort shall report source telecommand mean telecommand verification report,F, context_OBCP_ECSS_E_ST_70_01C  context_verification_E context_request_E context_parameter_E context_report_E context_verification_report_E context_source_E context_telecommand_E 
ECSS_E_ST_70_01C,ECSS-E-ST-70-01_1060080,execution obcp request command onboard shall report ground system mean event report contain follow information identity source request obcp operation note example obsw application another obcp obcp identifier object request execution status request operation,F, context_OBCP_ECSS_E_ST_70_01C context_OBSW_ECSS_E_ST_70_01C context_For_E  context_operation_E context_system_E context_command_E context_request_E context_ground_system_E context_event_E context_event_report_E context_report_E context_source_E 
ECSS_E_ST_70_01C,ECSS-E-ST-70-01_1060081,obcp engine shall report runtime error detect execution obcp mean event report,F, context_OBCP_ECSS_E_ST_70_01C  context_obcp_engine_ECSS_E_ST_70_01C context_event_E context_event_report_E context_report_E 
ECSS_Q_ST_30_09C,ECSS-Q-ST-30-09_0400001,availability requirement shall respect mandatory characteristic define system engineering process note eg traceable identify unique unambiguous,M,  context_system_Q context_process_Q context_availability_ECSS context_requirement_ECSS 
ECSS_Q_ST_30_09C,ECSS-Q-ST-30-09_0400002,availability requirement verification method shall exist,M, context_For_Q  context_verification_Q context_availability_ECSS context_requirement_ECSS 
ECSS_Q_ST_30_09C,ECSS-Q-ST-30-09_0400003,availability requirement shall quantitative requirement,M,  context_availability_ECSS context_requirement_ECSS 
ECSS_Q_ST_30_09C,ECSS-Q-ST-30-09_0400006,availability requirement shall specify accord one several follow class availability specification detail clause,M,  context_specification_ECSS context_availability_ECSS context_requirement_ECSS 
ECSS_Q_ST_30_09C,ECSS-Q-ST-30-09_0400007,type availability requirement specify figure shall define mean best estimate probability figure point estimation unit failure rate generally compute way sometimes confidence level,M, context_For_Q  context_unit_ECSS context_failure_Q context_availability_ECSS context_requirement_ECSS 
ECSS_Q_ST_30_09C,ECSS-Q-ST-30-09_0400008,operative scenario duration longer system equipment mean time mdt instantaneous mean availability reach asymptotic steady state behaviour requirement shall formulate term steadystate availability assure simplify generally conservative approach,M,  context_system_Q context_mean_availability_ECSS_Q_ST_30_09C context_availability_ECSS context_equipment_ECSS context_requirement_ECSS 
ECSS_Q_ST_30_09C,ECSS-Q-ST-30-09_0400009,availability mission lifetime shall compute ratio time service fulfil total mission lifetime,M,  context_mission_ECSS context_availability_ECSS context_lifetime_ECSS 
ECSS_Q_ST_30_09C,ECSS-Q-ST-30-09_0400010,nonmaintainable system availability mission lifetime requirement shall establish consider mission still operational end life note example single point failure consider unavailability contributor,M, context_For_Q  context_mission_ECSS context_failure_Q context_system_Q context_operational_Q context_availability_ECSS context_lifetime_ECSS context_requirement_ECSS context_single_point_failure_ECSS 
ECSS_Q_ST_30_09C,ECSS-Q-ST-30-09_0400013,availability specific time requirement shall address probability quasiinstantaneous operation successfully handle,M,  context_availability_ECSS context_requirement_ECSS 
ECSS_Q_ST_30_09C,ECSS-Q-ST-30-09_0400014,nonmaintainable system availability specific time requirement shall specify single requirement availability reliability characteristic,M, context_For_Q  context_system_Q context_availability_ECSS context_reliability_ECSS context_requirement_ECSS 
ECSS_Q_ST_30_09C,ECSS-Q-ST-30-09_0400016,availability specify percentage number successfully deliver product availability requirement shall express follow ratio successfully deliver product number request product note instance wrt applicable criterion performance delay coverage cumulate service hour mission note example expect number twts x hour operation redundant channel configuration year acquire database volume percentage note example geographical coverage earth observation mission,M, context_wrt_ECSS_Q_ST_30_09C context_For_Q  context_mission_ECSS context_configuration_ECSS context_availability_ECSS context_performance_Q context_product_ECSS context_requirement_ECSS 
ECSS_Q_ST_30_09C,ECSS-Q-ST-30-09_0400019,availability requirement shall quantify use one several follow metric inherent instantaneous availability operational instantaneous availability inherent mean availability operational mean availability inherent steadystate availability operational steadystate outage duration occurrence mut mdt mean time restore mtbf mtbo mttr mttf mtto amount successfully deliver product,M, context_MTTF_ECSS_Q_ST_30_09C context_MDT_ECSS_Q_ST_30_09C context_MTBF_ECSS_Q_ST_30_09C context_MUT_ECSS_Q_ST_30_09C  context_metric_Q context_operational_Q context_instantaneous_availability_ECSS_Q_ST_30_09C context_mean_availability_ECSS_Q_ST_30_09C context_outage_ECSS_Q_ST_30_09C context_availability_ECSS context_product_ECSS context_requirement_ECSS 
ECSS_Q_ST_30_09C,ECSS-Q-ST-30-09_0400020,follow definition system level availability requirement accord clause availability metric support metric shall select accord table,M,  context_system_Q context_metric_Q context_availability_ECSS context_requirement_ECSS 
ECSS_Q_ST_40CRev1,ECSS-Q-ST-40_0440082,safety requirement shall identify traced system level design allocate lower level,M,  context_system_Q context_design_ECSS context_requirement_ECSS context_safety_ECSS 
ECSS_Q_ST_40CRev1,ECSS-Q-ST-40_0440083,specify project identify safety requirement shall justified design present appropriate document,M,  context_design_ECSS context_project_ECSS context_requirement_ECSS context_safety_ECSS 
ECSS_Q_ST_80CRev1,ECSS-Q-ST-80_0720001,supplier shall ensure organizational structure define software development individual define task responsibility,PM,  context_software_ECSS_Q_ST_80CRev1 context_development_ECSS context_supplier_ECSS 
ECSS_Q_ST_80CRev1,ECSS-Q-ST-80_0720002,responsibility authority interrelation personnel manage perform verify work affect software quality shall define document,PM,  context_software_ECSS_Q_ST_80CRev1 context_quality_ECSS 
ECSS_Q_ST_80CRev1,ECSS-Q-ST-80_0720003,responsibility interfaces organisation either external internal involve project shall define document,PM,  context_project_ECSS 
ECSS_Q_ST_80CRev1,ECSS-Q-ST-80_0720004,delegation software product assurance task supplier lower level supplier shall do document controlled way supplier retain responsibility towards customer,PM,  context_software_ECSS_Q_ST_80CRev1 context_software_product_assurance_ECSS_Q_ST_80CRev1 context_assurance_ECSS context_customer_ECSS context_product_ECSS context_product_assurance_ECSS context_supplier_ECSS 
ECSS_Q_ST_80CRev1,ECSS-Q-ST-80_0720005,supplier shall provide adequate resource perform require software product assurance task,PM,  context_software_ECSS_Q_ST_80CRev1 context_software_product_assurance_ECSS_Q_ST_80CRev1 context_assurance_ECSS context_product_ECSS context_product_assurance_ECSS context_supplier_ECSS 
ECSS_Q_ST_80CRev1,ECSS-Q-ST-80_0720006,review audit process product shall carry personnel directly involve work perform,PM,  context_process_Q context_audit_ECSS context_product_ECSS context_review_ECSS 
ECSS_Q_ST_80CRev1,ECSS-Q-ST-80_0720007,supplier shall identify personnel responsible software product assurance project sw pa managerengineer,PM, context_PA_Q  context_software_ECSS_Q_ST_80CRev1 context_software_product_assurance_ECSS_Q_ST_80CRev1 context_assurance_ECSS context_product_ECSS context_product_assurance_ECSS context_project_ECSS context_supplier_ECSS 
ECSS_Q_ST_80CRev1,ECSS-Q-ST-80_0720008,software product assurance managerengineer shall report project manager project product assurance manager organisational authority independence propose maintain software product assurance programme accordance project software product assurance requirement unimpeded access higher management necessary fulfil hisher duty,PM,  context_software_ECSS_Q_ST_80CRev1 context_software_product_assurance_ECSS_Q_ST_80CRev1 context_assurance_ECSS context_product_ECSS context_product_assurance_ECSS context_project_ECSS context_requirement_ECSS 
ECSS_Q_ST_80CRev1,ECSS-Q-ST-80_0720009,supplier shall review project requirement establish make timely provision acquire develop resource skill management technical staff,PM,  context_project_ECSS context_provision_ECSS context_requirement_ECSS context_review_ECSS context_supplier_ECSS 
ECSS_Q_ST_80CRev1,ECSS-Q-ST-80_0720039,supplier shall establish software product assurance requirement next level supplier tailor role project include requirement produce software product assurance plan,M,  context_software_ECSS_Q_ST_80CRev1 context_software_product_assurance_ECSS_Q_ST_80CRev1 context_assurance_ECSS context_product_ECSS context_product_assurance_ECSS context_project_ECSS context_requirement_ECSS context_supplier_ECSS 
ECSS_Q_ST_80CRev1,ECSS-Q-ST-80_0720040,supplier shall provide software product assurance requirement applicable next level supplier customer acceptance,PM,  context_software_ECSS_Q_ST_80CRev1 context_software_product_assurance_ECSS_Q_ST_80CRev1 context_acceptance_ECSS context_assurance_ECSS context_customer_ECSS context_product_ECSS context_product_assurance_ECSS context_requirement_ECSS context_supplier_ECSS 
ECSS_Q_ST_80CRev1,ECSS-Q-ST-80_0720151,definition software relate system requirement specify requirement baseline ecssest clause shall apply,PM, context_For_Q  context_system_Q context_software_ECSS_Q_ST_80CRev1 context_baseline_ECSS context_requirement_ECSS 
ECSS_Q_ST_80CRev1,ECSS-Q-ST-80_0720157,addition functional requirement technical specification shall include nonfunctional requirement necessary satisfy requirement baseline include minimum following performance safety reliability robustness quality maintainability configuration management security privacy metrication verification validation,V,  context_specification_ECSS context_validation_ECSS_Q_ST_80CRev1 context_verification_ECSS_Q_ST_80CRev1 context_configuration_ECSS context_baseline_ECSS context_configuration_management_ECSS context_maintainability_ECSS context_performance_Q context_quality_ECSS context_reliability_ECSS context_requirement_ECSS context_safety_ECSS context_security_ECSS 
ECSS_Q_ST_80CRev1,ECSS-Q-ST-80_0720158,prior technical specification elaboration customer supplier shall agree follow principle rule minimum assignment person side responsible establish technical specification method agree requirement approve change effort prevent misunderstanding definition term explanation background requirement record review discussion result side,PM,  context_specification_ECSS context_customer_ECSS context_requirement_ECSS context_review_ECSS context_supplier_ECSS 
ECSS_Q_ST_80CRev1,ECSS-Q-ST-80_0720228,software quality requirement include safety dependability requirement shall derive requirement defined system level,M,  context_system_Q context_software_ECSS_Q_ST_80CRev1 context_dependability_ECSS context_quality_ECSS context_requirement_ECSS context_safety_ECSS 
ECSS_Q_ST_80CRev1,ECSS-Q-ST-80_0720229,quality requirement shall express quantitative term constraint,M,  context_quality_ECSS context_requirement_ECSS 
ECSS_Q_ST_80CRev1,ECSS-Q-ST-80_0720230,supplier shall define assurance activity ensure product meet quality requirement specify technical specification,PM,  context_specification_ECSS context_assurance_ECSS context_product_ECSS context_quality_ECSS context_requirement_ECSS context_supplier_ECSS 
ECSS_Q_ST_80CRev1,ECSS-Q-ST-80_0720231,order verify implementation product quality requirement supplier shall define metrication programme base identified quality model see clause specify metric collect stored mean collect metric measurement target value reference product quality requirement analyse perform collected metric include one derive descriptive statistic b trend analysis trend software problem result analysis perform collected metric feed back development team use identify corrective action schedule metric collection store analysis reporting reference whole software life cycle,PM,  context_life_cycle_ECSS context_metric_ECSS_Q_ST_80CRev1 context_quality_model_ECSS_Q_ST_80CRev1 context_software_ECSS_Q_ST_80CRev1 context_software_problem_ECSS_Q_ST_80CRev1 context_model_ECSS context_cycle_Q context_analysis_ECSS context_corrective_action_ECSS context_development_ECSS context_product_ECSS context_quality_ECSS context_requirement_ECSS context_supplier_ECSS 
ECSS_Q_ST_80CRev1,ECSS-Q-ST-80_0720232,follow basic product metric shall use size code complexity design code fault density failure intensity test coverage number failure,NF,  context_failure_Q context_metric_ECSS_Q_ST_80CRev1 context_design_ECSS context_fault_ECSS context_product_ECSS context_test_ECSS 
ECSS_Q_ST_80CRev1,ECSS-Q-ST-80_0720233,result metric collection analysis shall include software product assurance report order provide customer insight level quality obtain,NF,  context_metric_ECSS_Q_ST_80CRev1 context_software_ECSS_Q_ST_80CRev1 context_software_product_assurance_ECSS_Q_ST_80CRev1 context_analysis_ECSS context_assurance_ECSS context_customer_ECSS context_product_ECSS context_product_assurance_ECSS context_quality_ECSS 
ECSS_Q_ST_80CRev1,ECSS-Q-ST-80_0720234,numerical accuracy shall estimate verify,NF,  
ECSS_Q_ST_80CRev1,ECSS-Q-ST-80_0720235,supplier shall define organization mean implement collect analyse data require study software maturity,NF,  context_software_ECSS_Q_ST_80CRev1 context_supplier_ECSS 
ECSS_Q_ST_80CRev1,ECSS-Q-ST-80_0720236,software quality requirement shall document requirement baseline technical specification,M,  context_specification_ECSS context_software_ECSS_Q_ST_80CRev1 context_baseline_ECSS context_quality_ECSS context_requirement_ECSS 
ECSS_Q_ST_80CRev1,ECSS-Q-ST-80_0720237,software requirement shall correct unambiguous complete consistent verifiable traceable,M,  context_software_ECSS_Q_ST_80CRev1 context_requirement_ECSS 
ECSS_Q_ST_80CRev1,ECSS-Q-ST-80_0720238,requirement method verification validation shall specify,M, context_For_Q  context_validation_ECSS_Q_ST_80CRev1 context_verification_ECSS_Q_ST_80CRev1 context_requirement_ECSS 
ECSS_S_ST_00C,ECSS-S-ST-00_1000001,customer shall select ec standard make applicable use establish projectproduct requirement include use ecsssst term definition,PM, context_ECSS_S  context_customer_S context_requirement_S context_standard_S 
ECSS_S_ST_00C,ECSS-S-ST-00_1000002,customer shall define part project requirement documentation prd set requirement tailor ec document project specificity make applicable,PM, context_ECSS_S  context_customer_S context_part_S context_project_S context_requirement_S 
ECSS_S_ST_00C,ECSS-S-ST-00_1000003,customer shall produce part prd documentation identify ec requirement applicable project,PM, context_ECSS_S  context_customer_S context_part_S context_project_S context_requirement_S 
ECSS_S_ST_00C,ECSS-S-ST-00_1000004,documentation identifying requirement applicable project shall include follow data eg earm complete list ec standard either fully partially applicable projectproduct include standard ec make applicable via chain normative reference partially applicable standard status requirement applicable without modification applicable modification applicable complete list additional requirement modify additional requirement complete formulation,V, context_ECSS_S  context_normative_S context_project_S context_requirement_S context_standard_S 
ECSS_S_ST_00C,ECSS-S-ST-00_1000005,supplier shall demonstrate compliance prd requirement,PM, context_PRD_ECSS_S_ST_00C  context_requirement_S context_supplier_S 
ECSS_S_ST_00C,ECSS-S-ST-00_1000006,documentation identify compliance ec requirement applicable project eg ecm shall include follow data complete list ec requirement applicable project eg earm requirement actual indication compliance deviation identify justification provide,V, context_ECSS_S  context_deviation_S context_project_S context_requirement_S 
ECSS_E_ST_10CRev1,ECSS-E-ST-10_0790004,system engineering function shall analyse requirement system issue customer,PM,  context_system_engineering_ECSS_E_ST_10CRev1 context_function_E context_system_E context_customer_ECSS context_requirement_ECSS 
