ECSS Source Reference,ID,RequirementText,_class_,Context
ECSS_E_ST_20_08C,ECSS-E-ST-20-08_0090269,continuous pulse light source calibrate conformance clause shall use verify requirement give clause electrical characterization,NF,  context_source_E context_conformance_ECSS context_requirement_ECSS 
ECSS_E_ST_20_08C,ECSS-E-ST-20-08_0090552,design coverglasses shall enable bond solar cell space qualify adhesive,NF,  context_design_ECSS context_solar_cell_ECSS 
ECSS_E_ST_20_08C,ECSS-E-ST-20-08_0090553,test qualification coverglasses shall comprise acceptance qualification test,NF,  context_qualification_test_E context_acceptance_ECSS context_qualification_ECSS context_test_E 
ECSS_E_ST_20_08C,ECSS-E-ST-20-08_0090554,test procurement qualified coverglasses shall comprise acceptance test,NF,  context_acceptance_test_ECSS_E_ST_20_08C context_acceptance_ECSS context_test_E 
ECSS_E_ST_20_08C,ECSS-E-ST-20-08_0090555,condition method test shall conform coverglass source control draw scdcvg note coverglass specification consist two part standard scdcvg preparation scdcvg refer annex,NF, context_For_E  context_specification_E context_condition_E context_coverglass_ECSS_E_ST_20_08C context_source_E context_part_ECSS context_standard_ECSS context_test_E 
ECSS_E_ST_20_08C,ECSS-E-ST-20-08_0090602,dimension associate tolerance coverglass shall state scdcvg conform tolerance limit define figure,NF,  context_coverglass_ECSS_E_ST_20_08C context_tolerance_E 
ECSS_E_ST_20_08C,ECSS-E-ST-20-08_0090603,value tolerance weight coverglass verify determining average weight per shipping lot shall state scdcvg,NF,  context_coverglass_ECSS_E_ST_20_08C context_lot_E context_value_E context_tolerance_E 
ECSS_E_ST_20_08C,ECSS-E-ST-20-08_0090604,density tolerance sample glass weigh air water use analytical balance c shall conform requirement state scdcvg note density calculate measure specific gravity density water c,NF,  context_requirement_ECSS context_tolerance_E 
ECSS_E_ST_20_08C,ECSS-E-ST-20-08_0090605,coverglass thickness along associated tolerance shall state scdcvg,NF,  context_coverglass_ECSS_E_ST_20_08C context_tolerance_E 
ECSS_E_ST_20_08C,ECSS-E-ST-20-08_0090606,thickness shall measure use calibrated micrometer,NF,  
ECSS_E_ST_20_08C,ECSS-E-ST-20-08_0090607,edge parallelism shall state scdcvg,NF,  
ECSS_E_ST_20_08C,ECSS-E-ST-20-08_0090608,edge parallelism shall measure use calibrated micrometer,NF,  
ECSS_E_ST_20_08C,ECSS-E-ST-20-08_0090609,perpendicularity side coverglass shall measure use optical instrument reference normal,NF,  context_coverglass_ECSS_E_ST_20_08C context_reference_E 
ECSS_E_ST_20_08C,ECSS-E-ST-20-08_0090610,perpendicularity shall state scdcvg,NF,  
ECSS_E_ST_20_08C,ECSS-E-ST-20-08_0090611,reflectance shall measure use calibrated spectrophotometer use wreflectance method integrating sphere,NF,  
ECSS_E_ST_20_08C,ECSS-E-ST-20-08_0090612,wavelength tolerance shall l nm reflectance tolerance r l r state scdcvg,NF, context_R_E  context_tolerance_E 
ECSS_E_ST_20_08C,ECSS-E-ST-20-08_0090613,reflectance cuton shall state scdcvg,NF,  
ECSS_E_ST_20_08C,ECSS-E-ST-20-08_0090614,reflectance cutoff shall state scdcvg,NF,  
ECSS_E_ST_20_08C,ECSS-E-ST-20-08_0090615,reflectance bandwidth shall state scdcvg,NF,  
ECSS_E_ST_20_08C,ECSS-E-ST-20-08_0091063,room cleanliness level airborne particle count class iso,NF, context_ISO_E  context_particle_E context_cleanliness_E 
ECSS_E_ST_20_08C,ECSS-E-ST-20-08_0091064,standard atmospheric condition may assume general application spacecraft period time agree supplier customer,NF,  context_spacecraft_E context_condition_E context_customer_ECSS context_standard_ECSS context_supplier_ECSS 
ECSS_E_ST_20_08C,ECSS-E-ST-20-08_0091065,nonmagnetic material use,NF,  context_material_ECSS 
ECSS_E_ST_40C,ECSS-E-ST-40_0860001,customer shall derive system requirement allocate software analysis specific intend use system result safety dependability analysis,PM,  context_system_E context_software_ECSS_E_ST_40C context_analysis_E context_customer_ECSS context_dependability_ECSS context_requirement_ECSS context_safety_ECSS 
ECSS_E_ST_40C,ECSS-E-ST-40_0860002,customer shall specify software observability requirement monitor software behaviour facilitate system integration failure investigation,PM,  context_failure_E context_system_E context_software_ECSS_E_ST_40C context_software_observability_ECSS_E_ST_40C context_observability_E context_customer_ECSS context_integration_E context_requirement_ECSS 
ECSS_E_ST_40C,ECSS-E-ST-40_0860003,customer shall specify hmi requirement follow human factor engineering process specify ecssest,PM, context_HMI_ECSS_E_ST_40C  context_process_ECSS context_customer_ECSS context_requirement_ECSS 
ECSS_E_ST_40C,ECSS-E-ST-40_0860004,customer shall specify requirement need plan set system verification validation process relate software,PM,  context_need_E context_system_E context_software_ECSS_E_ST_40C context_validation_ECSS_E_ST_40C context_verification_ECSS_E_ST_40C context_process_ECSS context_customer_ECSS context_requirement_ECSS 
ECSS_E_ST_40C,ECSS-E-ST-40_0860005,customer shall specify requirement validation software requirement baseline technical specification particular mission representative data scenario operational procedure use,PM,  context_mission_E context_specification_E context_procedure_E context_operational_ECSS_E_ST_40C context_software_ECSS_E_ST_40C context_validation_ECSS_E_ST_40C context_baseline_ECSS context_customer_ECSS context_requirement_ECSS 
ECSS_E_ST_40C,ECSS-E-ST-40_0860006,customer shall specify requirement installation acceptance software,PM,  context_software_ECSS_E_ST_40C context_acceptance_ECSS context_customer_ECSS context_requirement_ECSS 
ECSS_E_ST_40C,ECSS-E-ST-40_0860007,customer shall identify software version deliver associate requirement requirement baseline version,PM,  context_software_ECSS_E_ST_40C context_baseline_ECSS context_customer_ECSS context_requirement_ECSS 
ECSS_E_ST_40C,ECSS-E-ST-40_0860008,customer shall specify content medium delivery,PM,  context_customer_ECSS 
ECSS_E_ST_40C,ECSS-E-ST-40_0860009,customer shall specify support provide software supplier order integrate software system level note example rain maintenance configuration test support,PM, context_For_E  context_system_E context_software_ECSS_E_ST_40C context_configuration_E context_customer_ECSS context_maintenance_ECSS context_supplier_ECSS context_test_E 
ECSS_E_ST_40C,ECSS-E-ST-40_0860010,customer shall specify external interface software include static dynamic aspect nominal degrade mode,PM,  context_interface_E context_software_ECSS_E_ST_40C context_mode_E context_external_interface_E context_customer_ECSS context_static_E 
ECSS_E_ST_40C,ECSS-E-ST-40_0860011,customer shall specify content system database supplier order ensure consistency common data define allow operational range data,PM,  context_system_E context_operational_ECSS_E_ST_40C context_customer_ECSS context_supplier_ECSS 
ECSS_E_ST_40C,ECSS-E-ST-40_0860012,customer shall define specific development design constraint supplier include use development standard,PM,  context_constraint_E context_customer_ECSS context_design_ECSS context_development_ECSS context_standard_ECSS context_supplier_ECSS 
ECSS_E_ST_40C,ECSS-E-ST-40_0860013,customer shall specify requirement implement obcp note see ecssest,PM,  context_customer_ECSS context_requirement_ECSS 
ECSS_E_ST_40C,ECSS-E-ST-40_0860014,customer shall specify reusability requirement apply development enable future reuse software include model use generate software customization mission eg family spacecraft launcher,PM,  context_mission_E context_spacecraft_E context_reusability_ECSS_E_ST_40C context_software_ECSS_E_ST_40C context_model_E context_customer_ECSS context_development_ECSS context_launcher_ECSS context_requirement_ECSS 
ECSS_E_ST_40C,ECSS-E-ST-40_0860015,customer shall specify software safety dependability requirement accordance ecssqst clause base result safety dependability analysis perform system level,PM,  context_system_E context_software_ECSS_E_ST_40C context_analysis_E context_customer_ECSS context_dependability_ECSS context_requirement_ECSS context_safety_ECSS 
ECSS_E_ST_40C,ECSS-E-ST-40_0860016,customer shall specify format delivery medium exchange data particular interface system database,PM,  context_interface_E context_system_E context_customer_ECSS 
ECSS_E_ST_40C,ECSS-E-ST-40_0860017,customer shall conduct system requirement review srr accordance,PM,  context_system_E context_customer_ECSS context_requirement_ECSS context_review_ECSS 
ECSS_E_ST_40C,ECSS-E-ST-40_0860018,software supplier shall define follow software life cycle include phase input output joint review accordance overall project constraint ecssmst,PM,  context_constraint_E context_life_cycle_E context_software_ECSS_E_ST_40C context_joint_E context_project_ECSS context_review_ECSS context_supplier_ECSS 
ECSS_E_ST_40C,ECSS-E-ST-40_0860019,life cycle shall choose assess specific project technical approach relevant project risk,PM,  context_life_cycle_E context_project_ECSS context_risk_ECSS 
ECSS_E_ST_40C,ECSS-E-ST-40_0860020,software supplier shall define development strategy software engineering standard technique software development software test environment,PM,  context_environment_E context_software_ECSS_E_ST_40C context_development_ECSS context_standard_ECSS context_supplier_ECSS context_test_E 
ECSS_E_ST_40C,ECSS-E-ST-40_0860021,output phase status completion submit input joint review shall specify software life cycle definition include document complete outline version result verification output phase,PM,  context_life_cycle_E context_software_ECSS_E_ST_40C context_verification_ECSS_E_ST_40C context_joint_E context_review_ECSS 
ECSS_E_ST_40C,ECSS-E-ST-40_0860022,interface development maintenance eg document hand tool keep maintenance shall identify software life cycle,PM,  context_life_cycle_E context_interface_E context_software_ECSS_E_ST_40C context_development_ECSS context_maintenance_ECSS 
ECSS_E_ST_40C,ECSS-E-ST-40_0860023,supplier shall document implement software procurement process specify ecssqst clause,PM,  context_software_ECSS_E_ST_40C context_process_ECSS context_supplier_ECSS 
ECSS_E_ST_40C,ECSS-E-ST-40_0860024,autocode input model shall review together rest software specification architecture design note autocode input model integral part software specification architecture design,PM,  context_specification_E context_software_ECSS_E_ST_40C context_model_E context_design_ECSS context_part_ECSS context_review_ECSS 
ECSS_E_ST_40C,ECSS-E-ST-40_0860025,case coexist autocoded manually write part software development plan shall include definition clear interface definition resource allocation memory cpu pdr,PM,  context_interface_E context_software_ECSS_E_ST_40C context_memory_E context_resource_E context_development_ECSS context_part_ECSS 
ECSS_E_ST_40C,ECSS-E-ST-40_0860026,input model management code generation process support tool shall document sdp,PM,  context_model_E context_process_ECSS 
ECSS_E_ST_40C,ECSS-E-ST-40_0860027,supplier shall define sdp verification validation strategy automatic code generation result trade qualification code generation toolchain end end validation strategy software item combination thereof relation ecssqst clause,PM,  context_automatic_code_generation_ECSS_E_ST_40C context_software_ECSS_E_ST_40C context_software_item_ECSS_E_ST_40C context_validation_ECSS_E_ST_40C context_verification_ECSS_E_ST_40C context_qualification_ECSS context_supplier_ECSS 
ECSS_E_ST_40C,ECSS-E-ST-40_0860028,configuration management automatic code generation related element shall define scmp,PM,  context_automatic_code_generation_ECSS_E_ST_40C context_configuration_E context_configuration_management_ECSS context_element_ECSS 
ECSS_E_ST_40C,ECSS-E-ST-40_0860029,change baseline shall handle configuration management process describe clause ecssqst,PM,  context_configuration_E context_process_ECSS context_baseline_ECSS context_configuration_management_ECSS 
ECSS_E_ST_40C,ECSS-E-ST-40_0860030,joint review shall hold evaluate progress output project process activity provide evidence output complete output conforms applicable standard specification change properly implement impact area identify configuration management process output conforms applicable schedule output status next activity start activity conduct accord plan schedule standard guideline lay project note joint review process process evaluate status product activity project appropriate process employ two party one party review party review another party review partyfor project review two party customer supplier joint review hold throughout life cycle software,PM,  context_life_cycle_E context_specification_E context_impact_E context_software_ECSS_E_ST_40C context_activity_E context_schedule_E context_configuration_E context_joint_E context_process_ECSS context_configuration_management_ECSS context_customer_ECSS context_product_ECSS context_project_ECSS context_review_ECSS context_standard_ECSS context_supplier_ECSS 
ECSS_E_ST_40C,ECSS-E-ST-40_0860031,software project review ie joint review organize responsibility customer aim define customer approve technical baseline shall include software life cycle minimum srr pdr cdr qr ar specify,PM, context_AR_ECSS_E_ST_40C context_QR_ECSS_E_ST_40C  context_life_cycle_E context_software_ECSS_E_ST_40C context_joint_E context_baseline_ECSS context_customer_ECSS context_project_ECSS context_review_ECSS 
ECSS_E_ST_40C,ECSS-E-ST-40_0860032,review process specify ecssmst shall apply software project review include agreement review plan review process start,PM,  context_software_ECSS_E_ST_40C context_process_ECSS context_project_ECSS context_review_ECSS context_agreement_E 
ECSS_E_ST_40C,ECSS-E-ST-40_0860033,addition software project review software technical review ie joint review organize responsibility customer supplier aim define technical baseline shall define,PM,  context_software_ECSS_E_ST_40C context_joint_E context_baseline_ECSS context_customer_ECSS context_project_ECSS context_review_ECSS context_supplier_ECSS 
ECSS_E_ST_40C,ECSS-E-ST-40_0860034,applicable technical review process shall specify supplier,PM,  context_process_ECSS context_review_ECSS context_supplier_ECSS 
ECSS_E_ST_40C,ECSS-E-ST-40_0860035,supplier shall use software technical review implement intermediate review particular incremental life cycle aim enable cope alternative life cycle necessarily waterfall case incremental life cycle particular enables hold formal review last increment technical review anticipation increment,PM,  context_life_cycle_E context_software_ECSS_E_ST_40C context_review_ECSS context_supplier_ECSS 
ECSS_E_ST_40C,ECSS-E-ST-40_0860036,completion software requirement baseline specification system requirement review srr shall take place aim reach approval software requirement baseline stakeholder,PM,  context_specification_E context_stakeholder_E context_system_E context_software_ECSS_E_ST_40C context_approval_ECSS context_baseline_ECSS context_requirement_ECSS context_review_ECSS 
ECSS_E_ST_40C,ECSS-E-ST-40_0860037,completion software requirement analysis architectural design verification validation process implementation preliminary design review pdr shall take place aim review compliance technical specification t requirement baseline review software architecture interfaces review development verification validation plan,PM,  context_specification_E context_software_ECSS_E_ST_40C context_validation_ECSS_E_ST_40C context_verification_ECSS_E_ST_40C context_process_ECSS context_analysis_E context_baseline_ECSS context_design_ECSS context_development_ECSS context_requirement_ECSS context_review_ECSS 
ECSS_E_ST_40C,ECSS-E-ST-40_0860038,case software requirement baselined start architectural design part pdr address software requirement specification interface specification shall hold separate joint review anticipate pdr software requirement review swrr aim eg case software intensive system early baseline requirement require,PM, context_PDR_ECSS_E_ST_40C  context_specification_E context_interface_E context_system_E context_software_ECSS_E_ST_40C context_software_intensive_system_ECSS_E_ST_40C context_joint_E context_baseline_ECSS context_design_ECSS context_part_ECSS context_requirement_ECSS context_review_ECSS 
ECSS_E_ST_40C,ECSS-E-ST-40_0860039,completion design software item cod test integration validation respect technical specification critical design review cdr shall take place aim review design definition file include software architectural design detail design code user manual review design justification file include completeness software unit test integration validation respect technical specification,PM,  context_specification_E context_user_E context_unit_E context_software_ECSS_E_ST_40C context_software_item_ECSS_E_ST_40C context_software_unit_ECSS_E_ST_40C context_unit_test_ECSS_E_ST_40C context_validation_ECSS_E_ST_40C context_critical_E context_design_ECSS context_integration_E context_review_ECSS context_test_E 
ECSS_E_ST_40C,ECSS-E-ST-40_0860040,case software detail design baselined start cod part cdr address software detailed design interface design software budget shall hold separate joint review anticipate cdr detail design review ddr,PM, context_CDR_ECSS_E_ST_40C  context_interface_E context_software_ECSS_E_ST_40C context_joint_E context_design_ECSS context_part_ECSS context_review_ECSS 
ECSS_E_ST_40C,ECSS-E-ST-40_0860041,completion software validation requirement baseline verification activity qualification review qr shall take place,PM,  context_software_ECSS_E_ST_40C context_validation_ECSS_E_ST_40C context_verification_ECSS_E_ST_40C context_activity_E context_baseline_ECSS context_qualification_ECSS context_requirement_ECSS context_review_ECSS 
ECSS_E_ST_40C,ECSS-E-ST-40_0860042,completion software delivery installation software acceptance acceptance review ar shall take place aim accept software product intend operational environment,PM,  context_environment_E context_operational_ECSS_E_ST_40C context_software_ECSS_E_ST_40C context_acceptance_ECSS context_product_ECSS context_review_ECSS 
ECSS_E_ST_40C,ECSS-E-ST-40_0860043,test readiness review trr shall hold begin test activity define software development plan,PM,  context_software_ECSS_E_ST_40C context_activity_E context_development_ECSS context_review_ECSS context_test_E 
ECSS_E_ST_40C,ECSS-E-ST-40_0860044,test review board trb shall approve test result end test activity define software development plan,PM,  context_software_ECSS_E_ST_40C context_activity_E context_development_ECSS context_review_ECSS context_test_E 
ECSS_E_ST_40C,ECSS-E-ST-40_0860045,flight software phase software life cycle system life cycle shall choose assess follow drive aspect system model philosophy eg protoflight model versus utilization engineering qualification model system verification qualification approach constraint capability baseline system design system cdr know enough information software design particular consolidate size time budget consistent hardware design software design,PM, context_For_E  context_model_philosophy_E context_constraint_E context_life_cycle_E context_system_E context_software_ECSS_E_ST_40C context_verification_ECSS_E_ST_40C context_capability_E context_model_E context_baseline_ECSS context_design_ECSS context_engineering_qualification_model_ECSS context_protoflight_model_ECSS context_qualification_ECSS context_qualification_model_ECSS 
ECSS_E_ST_40C,ECSS-E-ST-40_0860046,flight software follow software versus system level review synchronisation shall plan follow software srr later system pdr software pdr system pdr system cdr detail design software review system cdr eg ddr software cdr system qr software qr within system qr,PM, context_CDR_ECSS_E_ST_40C context_PDR_ECSS_E_ST_40C context_QR_ECSS_E_ST_40C context_SRR_ECSS_E_ST_40C context_DDR_ECSS_E_ST_40C context_For_E  context_system_E context_software_ECSS_E_ST_40C context_design_ECSS context_review_ECSS 
ECSS_E_ST_40C,ECSS-E-ST-40_0860047,ground segment software software life cycle shall choose assess follow constraint ground review phase baseline software requirement eg swrr perform ground segment pdr software pdr perform ground segment cdr software review perform ground segment qr,PM, context_CDR_ECSS_E_ST_40C context_PDR_ECSS_E_ST_40C context_For_E  context_constraint_E context_life_cycle_E context_software_ECSS_E_ST_40C context_ground_segment_E context_segment_E context_baseline_ECSS context_requirement_ECSS context_review_ECSS 
ECSS_E_ST_40C,ECSS-E-ST-40_0860048,interface management procedure shall define accordance ecssmst requirement aim define procedure guarantee consistency system interface,PM,  context_procedure_E context_interface_E context_system_E context_requirement_ECSS 
ECSS_E_ST_40C,ECSS-E-ST-40_0860049,technical budget target margin philosophy dedicate software shall specify customer requirement baseline order define limit software budget associate computer network resource cpu load maximum memory size deadline fulfilment communication archive need remote access need performance requirement data throughput aim allows anticipate expect change requirement baseline requirement reprogramming system operational use require budget temporary copy software image constraint state transition especially recovery faulty state concern constraint physical cpu type memory eg drive radiation level expect processor capacity wait state interface cache pipelining etc equipment communication performance aspects eg bus protocols acceptable error bus capacity usage source etc accuracy aspect conversion tofrom analogue signal accuracy time signal budget os kernel characterisation context switch latency deadline task mission system operation characteristic reference operational scenario note follow cpu load margin reference value often consider pdr ddr trr cdr qr ar note follow memory margin reference value ram eeprom often consider pdr ddr trr cdr qr ar,PM, context_CDR_ECSS_E_ST_40C context_QR_ECSS_E_ST_40C context_EEPROM_E context_CPU_ECSS_E_ST_40C context_DDR_ECSS_E_ST_40C context_RAM_E context_OS_E  context_constraint_E context_mission_E context_need_E context_operation_E context_task_E context_margin_E context_radiation_E context_interface_E context_system_E context_margin_philosophy_ECSS_E_ST_40C context_operational_ECSS_E_ST_40C context_software_ECSS_E_ST_40C context_accuracy_E context_memory_E context_target_E context_resource_E context_network_E context_signal_E context_source_E context_ram_E context_reference_E context_value_E context_switch_E context_baseline_ECSS context_customer_ECSS context_equipment_ECSS context_performance_ECSS context_requirement_ECSS 
ECSS_E_ST_40C,ECSS-E-ST-40_0860050,way compute technical budget margin shall agree customer supplier,PM,  context_margin_E context_customer_ECSS context_supplier_ECSS 
ECSS_E_ST_40C,ECSS-E-ST-40_0860051,supplier shall provide compliance matrix document conformance individual software engineering process requirement clause applicable project business agreement per ecsssst,PM,  context_software_ECSS_E_ST_40C context_process_ECSS context_business_agreement_ECSS context_conformance_ECSS context_project_ECSS context_requirement_ECSS context_supplier_ECSS context_agreement_E 
ECSS_E_ST_40C,ECSS-E-ST-40_0860052,compliance individual software engineering process requirement shall make reference document expect output place placed standard drds annex document note general statement compliance standard drds acceptable,PM,  context_software_ECSS_E_ST_40C context_statement_E context_reference_E context_process_ECSS context_requirement_ECSS context_standard_ECSS 
ECSS_E_ST_40C,ECSS-E-ST-40_0860053,supplier shall establish document software requirement include software quality requirement part technical specification,PM,  context_specification_E context_software_ECSS_E_ST_40C context_part_ECSS context_quality_ECSS context_requirement_ECSS context_supplier_ECSS 
ECSS_E_ST_40C,ECSS-E-ST-40_0860054,flight modification specify flight software supplier shall perform analysis specific implication software design validation process include functional performance requirement technical specification include case use automatic code generation,PM,  context_specification_E context_automatic_code_generation_ECSS_E_ST_40C context_software_ECSS_E_ST_40C context_validation_ECSS_E_ST_40C context_process_ECSS context_analysis_E context_design_ECSS context_performance_ECSS context_requirement_ECSS context_supplier_ECSS 
ECSS_E_ST_40C,ECSS-E-ST-40_0860055,supplier shall construct logical model functional requirement software product,PM,  context_logical_model_ECSS_E_ST_40C context_software_ECSS_E_ST_40C context_model_E context_product_ECSS context_requirement_ECSS context_supplier_ECSS 
ECSS_E_ST_40C,ECSS-E-ST-40_0860056,supplier shall use method support construction logical model,PM,  context_logical_model_ECSS_E_ST_40C context_model_E context_supplier_ECSS 
ECSS_E_ST_40C,ECSS-E-ST-40_0860058,supplier shall conduct software requirement review swrr anticipation pdr conformance b,PM,  context_software_ECSS_E_ST_40C context_conformance_ECSS context_requirement_ECSS context_review_ECSS context_supplier_ECSS 
