ID,RequirementText,_class_
ECSS-E-ST-40_0860049,"Technical budget targets and margin philosophy dedicated to the software shall be specified by the customer in the requirements baseline in order to define the limits of software budgets associated with computer and network resources (such as: CPU load, maximum memory size, deadline fulfilment, communication, archiving needs, remote access needs) and performance requirements (such as data throughput). AIM: This allows anticipating: - Expected changes in the requirements baseline  - Requirements on reprogramming of the system during operational use  - Required budget for temporary copies of software images - Constraints on state transitions, especially when recovery from a faulty state is concerned  - Constraints on physical CPU type and memory (e.g. driven by radiation levels) and expected processor capacity, wait states, interfaces, caching and pipelining, etc - Equipment, communication and performances aspects (e.g. buses, protocols, acceptable errors, bus capacity usage by other sources, etc)  - Accuracy aspects, such as conversion to/from analogue signals, and accuracy of timing signals - Budgets for OS kernel characterisation, such as context switch latency or deadlines for tasking - Mission and system operation characteristics and reference operational scenarios     NOTE 1 The following CPU load margin reference values are often considered: 50 % at PDR, 35 % at DDR or TRR, 25 % at CDR, QR or AR.     NOTE 2 The following memory margin reference values in RAM or EEPROM are often considered: 50 % at PDR, 40 % at DDR or TRR, 35 % at CDR and 25 % at QR or AR. ",PM
ECSS-E-ST-40_0860050,The way to compute the technical budgets and margin shall be agreed between the customer and the supplier. ,PM
ECSS-E-ST-40_0860051,"The supplier shall provide a compliance matrix documenting conformance with the individual software engineering process requirements (Clause 5) applicable to the project or business agreement, as per ECSS-S-ST-00. ",PM
ECSS-E-ST-40_0860052,"The compliance to each of the individual software engineering process requirements shall make reference to the document where the expected output is placed, if it is not placed in this Standard’s DRDs in annexes of this document.     NOTE A general statement of compliance to this Standard’s DRDs is acceptable. ",PM
ECSS-E-ST-40_0860053,"The supplier shall establish and document software requirements, including the software quality requirements, as part of the technical specification. ",PM
ECSS-E-ST-40_0860054,"When in flight modification is specified for flight software, the supplier shall perform analysis of the specific implications for the software design and validation processes and include the functional and performance requirements in the technical specification, including in case of use of automatic code generation. ",PM
ECSS-E-ST-40_0860055,The supplier shall construct a logical model of the functional requirements of the software product. ,PM
ECSS-E-ST-40_0860056,The supplier shall use a method to support the construction of the logical model. ,PM
ECSS-E-ST-40_0860057,The logical model shall include a behavioural view.  ,V
ECSS-E-ST-40_0860058,"The supplier shall conduct a software requirement review (SWRR) as anticipation of the PDR, in conformance with 5.3.4.2b.",PM
ECSS-E-ST-40_0860059,"The supplier shall transform the requirements for the software item into an architecture that:     1. describes its top-level structure;     2. identifies the software components, ensuring that all the requirements for the software item are allocated to its software components and later refined to facilitate detailed design;     3. covers as a minimum hierarchy, dependency, interfaces and operational usage for the software components;     4. documents the process, data and control aspects of the product;     5. describes the architecture static decomposition into software elements such as packages, classes or units;     6. describes the dynamic architecture, which involves the identification of active objects such as threads, tasks and processes;     7. describes the software behaviour. ",PM
ECSS-E-ST-40_0860060,"The supplier shall use a method (e.g. object oriented or functional) to produce the static and dynamic architecture including:      1. software elements, their interfaces, and;     2. software elements relationships. ",PM
ECSS-E-ST-40_0860061,The dynamic architecture design shall be described according to an analysable computational model.  ,PM
ECSS-E-ST-40_0860062,"The software architecture design shall also describe the behaviour of the software, by means of description techniques using automata and scenarios. ",PM
ECSS-E-ST-40_0860063,The supplier shall develop and document a software preliminary design for the interfaces external to the software item and between the software components of the software item. ,PM
ECSS-E-ST-40_0860064,"The supplier shall define procedures, methods and tools for reuse, and apply these to the software engineering processes to comply with the reusability requirements for the software development.  ",PM
ECSS-E-ST-40_0860065,An evaluation of the reuse potential of the software shall be performed at PDR and CDR. ,PM
ECSS-E-ST-40_0860066,The supplier shall design the software such that mission and configuration dependant data are separated e.g. in a database. ,PM
ECSS-E-ST-40_0860067,"The analysis of the potential reusability of existing software components shall be performed through:     1. identification of the reuse components and models with respect to the functional requirements baseline, and;     2. a quality evaluation of these components, applying ECSS-Q-ST-80 clause 6.2.7. ",PM
ECSS-E-ST-40_0860068,"The supplier shall define and document the preliminary software integration strategy in terms of responsibility and schedule, control procedures and testing approach (goals to be achieved, sequence, environment and criteria). ",PM
ECSS-E-ST-40_0860069,The supplier shall conduct a preliminary design review (PDR) in accordance with clause 5.3.4.2.      NOTE The successful completion of the review establishes a baseline for the development of the software item.,PM
ECSS-E-ST-40_0860070,The supplier shall develop a detailed design for each component of the software and document it.  ,PM
ECSS-E-ST-60-10_1020001,"The specification of a performance shall consist of:     1. The quantities to be constrained.         NOTE 1 This is usually done specifying the appropriate indices (APE, MPE, RPE, PDE, PRE) as defined in 3.2                                                              NOTE 2 All the elements needed to fully describe the constrained quantities are listed there; for example, the associated timescales for MPE or RPE.     2. The allowed range for each of these quantities.     3. The probability that each quantity lies within the specified range.         NOTE This is often called the confidence level. See 4.1.4;     4. The interpretation of this probability.         NOTE 1 This is often referred to as the “statistical interpretation”. See annex A.1.2                                                              NOTE 2 The way to specify the statistical interpretation is described in 4.1.4.2                                                     ",M
ECSS-E-ST-60-10_1020002,"When specifying a requirement on the knowledge of the performance, the following elements shall be specified:     1. The quantities to be constrained.         NOTE 1 This is usually done specifying the appropriate indices (AKE, MKE, RKE) as defined in 3.2                                                              NOTE 2 All the elements needed to fully describe the constrained quantities are listed there; for example, the associated timescales for MKE or RKE.     2. The allowed range for each of these quantities.     3. The probability that each quantity lies within the specified range.         NOTE This is often called the confidence level. See 4.1.4;     4. The interpretation of this probability.         NOTE 1 This is often referred to as the “statistical interpretation”. See annex A.1.2                                                              NOTE 2 The way to specify the statistical interpretation is described in 4.1.4.2                                                          5. The conditions under which the requirement applies.         NOTE These conditions can be that the requirement refers to the state of knowledge on-board, on ground before post processing, or after post processing. This is explained further in annex A.1.3.",M
ECSS-E-ST-60-10_1020003,In the general case all probabilities shall be expressed as fractions or as percentages.,M
ECSS-E-ST-60-10_1020004,"Using the ‘ns’ notation for expressing probabilities shall be restricted to cases where the hypothesis of Gaussian distribution holds.     NOTE 1 For example: in the general case Pc = 0,95 or Pc = 95 % are both acceptable, but Pc = 2s is not. Indeed the ‘ns’ format assumes a Gaussian distribution; using this notation for a general statistical distribution can cause wrong assumptions to be made. For a Gaussian the 95 % (2s) bound is twice as far from the mean as the 68 % (1s) bound, but this relation does not hold for a general distribution.     NOTE 2 Upon certain conditions the assumption of Gaussian distribution is not to be excluded a priory. For example the central limit theorem states that the sum of a large number of independent and identically-distributed random variables is approximately normally distributed.",M
ECSS-E-ST-60-10_1020005,"When specifying the statistical interpretation (4.1.2a.4), it shall be stated which variables are varied across their possible ranges and which are set to worst case.     NOTE The most commonly used interpretations (temporal, ensemble, mixed) are extreme cases and can be inappropriate in some situations. Annex A.1.2 discusses this further.",M
ECSS-E-ST-60-21_1350001,The gyro shall provide a Measurement Mode.,F
ECSS-E-ST-60-21_1350002,The TM data provided by the unit shall unambiguously report when the gyro has switched from Start-Up Mode to Measurement Mode.,F
ECSS-E-ST-60-21_1350003,The gyro shall perform a health-check at the end of the initialization phase.,F
ECSS-E-ST-60-21_1350004,"The health check shall comprise, as a minimum: 1.	communications 2.	memories 3.	processor function 4.	detector function",F
ECSS-E-ST-60-21_1350005,The gyro shall be capable to autonomously enter the measurement mode after power on.,F
ECSS-E-ST-60-21_1350006,It shall be possible to power off the gyro at any time and in any mode of operation without causing any damage to it.,F
ECSS-E-ST-60-21_1350007,The customer shall specify the transitions between the gyro operational modes and phases and the transient behaviours.,NF
ECSS-E-ST-60-21_1350008,A mode status shall be present in the housekeeping data.,NF
ECSS-E-ST-60-21_1350009,A reset capacity shall be available and commonly defined by the supplier and the customer.,F
ECSS-E-ST-60-21_1350010,The operating mode requirements shall be verified by test during qualification and acceptance tests.,NF
ECSS-E-ST-60-21_1350011,The gyro channels shall provide valid inertial data on the interface bus after switch-on of the equipment within the maximum specified duration for any angular rate within its input range.,F
ECSS-E-ST-60-21_1350012,The start-up performance specified in clause 5.4.7 shall be achieved within the maximum specified duration after switch-on.,NF
ECSS-E-ST-60-21_1350013,The start-up duration shall be measured by external means.,NF
ECSS-E-ST-60-21_1350014,The start-up requirement shall be tested over the whole range of operational temperatures and dynamics.,NF
ECSS-E-ST-60-21_1350015,The warm-up performance specified in clause 5.4.8 shall be achieved within a maximum duration after switch-on.,NF
ECSS-E-ST-60-21_1350016,The warm-up duration shall be measured by external means.,NF
ECSS-E-ST-60-21_1350017,The warm-up requirements shall be tested over the whole range of operational temperatures and dynamics.,NF
ECSS-E-ST-60-21_1350018,The gyro shall be capable to perform measurements together with the associated validity check and the sampling of housekeeping data at a frequency to be specified by the customer.,F
ECSS-E-ST-60-21_1350019,The data output of each gyro channel shall have its own date measurement related to a clock reference.,F
ECSS-E-ST-60-21_1350020,"If a time tag counter is used, it shall not be reset after each reading. ",F
ECSS-E-ST-60-21_1350021,The output data shall be time tagged during data collection by the means of a frame counter or a time stamp.,F
ECSS-E-ST-60-21_1350022,The unit shall be able to work either in synchronous mode or in continuous mode. ,NF
ECSS-E-ST-60-21_1350023,"When working in continuous mode, a time correlation mechanism shall be available to relate the gyro measurement date with the on-board time.",F
ECSS-E-ST-60-21_1350024,"When working in synchronous mode, the angular inertial data measurement acquisition shall be synchronized with the external interrogation signal.",F
ECSS-E-ST-60-21_1350025,"When the gyro is working in synchronous mode, the external interrogation signal shall have an accuracy as specified in clause 5.4.6.",NF
ECSS-E-ST-60-21_1350026,"When the gyro is working in synchronous mode, the equipment shall offer also the possibility to choose the synchronisation signal amongst two options:  1.	a synchronisation signal on the chosen data interface - broadcast or unicast on the data Bus or dedicated command on serial link-, or  2.	a pulse on a synchro link interface.",F
ECSS-E-ST-60-21_1350027,The requirements of 4.5.1 shall be verified by test with an external clock reference.,NF
ECSS-E-ST-60-21_1350035,The gyro shall provide in its periodic housekeeping data all the data required for the monitoring and execution of all nominal and foreseen contingency operations throughout the entire mission lifetime.,F
ECSS-E-ST-60-21_1350036,The gyro shall allow for on-request housekeeping data acquisition.,F
ECSS-E-ST-60-21_1350037,The verification test shall be performed with a test set-up representative of the interface requirements specified by the customer,NF
ECSS-E-ST-60-21_1350038,"The unit shall provide information in the housekeeping data allowing, in real time: 1.	detection of a single failure potentially degrading the measurement performances, or  2.	gyro loss of functionality.",F
ECSS-E-ST-60-21_1350039,An analysis of the possible failures covered by the health status shall be provided.,F
ECSS-E-ST-60-21_1350040,The verification method for failure diagnosis shall be proposed by the supplier and agreed with the customer.,NF
ECSS-E-ST-60-21_1350041,"During the gyro test, the health status and the occurrence of false alarms on failure detection shall be continuously monitored. ",NF
ECSS-E-ST-60-21_1350042,"The measurement mode shall provide: 1.	measurement data, including an angular rate, an angular increment or a cumulated angular increment, 2.	a health status, 3.	a data validity flag, and 4.	a timetag.",F
ECSS-E-ST-60-21_1350043,The gyro shall output a temperature measurement.,F
ECSS-E-ST-60-21_1350044,"If internal filtering or compensation is applied to the measurement, both raw and filtered or compensated data shall be provided.",F
ECSS-E-ST-60-21_1350045,"The measurement bandwidth shall be specified for each of the following outputs: 1.	angular rate, unfiltered or filtered, or 2.	an angular increment, unfiltered or filtered, or 3.	a cumulated angular increment, unfiltered.",F
ECSS-E-ST-60-21_1350046,The measurement mode functional requirements shall be verified by test.,NF
ECSS-E-ST-60-21_1350047,The gyro shall provide a Test mode. ,F
ECSS-E-ST-60-21_1350048,The use of the Test mode for the unit in-flight shall be specified if necessary.,F
ECSS-E-ST-60-21_1350049,The gyro shall provide a Programmable mode. ,F
ECSS-E-ST-60-21_1350050,The in-flight protection against misuse of these Test and Programmable modes shall be implemented in agreement with the user specification.,NF
ECSS-E-ST-60-21_1350051,The auxiliary modes functional requirements shall be verified by test.,NF
ECSS-E-ST-60-20_0920001,The acquisition command shall be supplied as minimum set of inputs.,F
ECSS-E-ST-60-20_0920002,"A sensor with cartography capability shall have the following minimum outputs: 1.	star position, 2.	measurement date.",F
ECSS-E-ST-60-20_0920003,"When the Star Image is measured in a Detector-fixed frame which is not the same as the Boresight Reference Frame (BRF), the output shall be converted into the Boresight Reference Frame (BRF).",F
ECSS-E-ST-60-20_0920004,The date of measurement shall be expressed as a (scalar) number indicating the delay relative to a known external time reference agreed with the customer.,NF
ECSS-E-ST-60-20_0920005,The minimum set of inputs to be supplied in order to initialize the Star Tracking shall be: 1.	the initial star position; 2.	the angular rate; 3.	validity date.,F
ECSS-E-ST-60-20_0920006,"For aided tracking, data specified in 4.1.3.1a shall be supplied regularly by the spacecraft, at an update rate and accuracy agreed by the customer.",NF
ECSS-E-ST-60-20_0920007,The unit of all inputs shall be indicated.,F
ECSS-E-ST-60-20_0920008,A sensor with the star tracking capability shall have the following minimum outputs: 1.	the position of each Star Image with respect to a sensor-defined reference frame; 2.	focal length if star position on the detector chip  is output in units of length; 3.	the measurement date.,F
ECSS-E-ST-60-20_0920009,The minimum set of inputs to be supplied in order to initialize the Autonomous Star Tracking shall be: 1.	the angular rate; 2.	the validity date.,F
ECSS-E-ST-60-20_0920010,"For aided tracking, data specified in 4.1.4.1a shall be supplied regularly by the spacecraft, at an update rate and accuracy agreed by the customer.",NF
ECSS-E-ST-60-20_0920011,The unit of all inputs shall be indicated.,F
ECSS-E-ST-60-20_0920012,A sensor with the autonomous star tracking capability shall have the minimum outputs: 1.	the position of each star image with respect to a sensor-defined reference frame; 2.	the Measurement date.,F
ECSS-E-ST-60-20_0920013,The acquisition command shall be supplied as a minimum set of inputs. ,F
ECSS-E-ST-60-20_0920155,The set of core commands defined in Annex I should be used.,NF
ECSS-E-ST-60-20_0920014,A sensor with autonomous attitude determination shall have the minimum outputs: 1.	the relative orientation of the defined sensor reference frame with respect to the defined inertial reference frame; 2.	the Measurement date; 3.	a validity index or flag estimating the validity of the determined attitude.,F
ECSS-E-ST-60-20_0920156,The set of core telemetries defined in Annex I should be used.,NF
ECSS-E-ST-60-20_0920015,The minimum set of inputs to be supplied in order to initialize the Autonomous Attitude Tracking shall be: 1.	the attitude quaternion; 2.	the 3-dimension angular rate vector giving the angular rate of the sensor BRF with respect to the IRF; 3.	the validity date for both supplied attitude and angular rate.,F
ECSS-E-ST-60-20_0920016,"For aided tracking, data specified in 4.1.6.1a shall be supplied regularly by the spacecraft, at an update rate and accuracy agreed by the customer.",NF
ECSS-E-ST-60-20_0920017,"Except for attitude quaternion, the unit of all inputs shall be indicated.",F
ECSS-E-ST-60-20_0920018,"The supplier shall document whether the star sensor initialization uses either: 1.	Internal initialization, or  2.	Direct initialization.",NF
ECSS-E-ST-60-20_0920157,The set of core commands defined in Annex I should be used.,NF
ECSS-E-ST-60-20_0920019,"A sensor with autonomous attitude tracking capability shall have the following minimum outputs: 1.	the orientation of the sensor defined reference frame with respect to the inertially defined reference frame (nominally in the form of an attitude quaternion); 2.	the Measurement date; 3.	a validity index or flag, estimating the validity of the determined attitude; 4.	measurement of Star Magnitude for each tracked Star Image.",F
ECSS-E-ST-60-20_0920158,The set of core telemetries defined in Annex I should be used.,NF
ECSS-E-ST-60-20_0920020,A sensor with angular rate measurement capability shall have the following minimum outputs: 1.	the instantaneous angular rates around the Boresight Reference Frame (BRF) axes relative to inertial space; 2.	the Measurement date.,F
ECSS-E-ST-60-20_0920021,The date of measurement shall be expressed as a (scalar) number indicating the delay) relative to a known external time reference agreed with the customer.,NF
ECSS-E-ST-60-20_0920159,The set of core commands and telemetries defined in Annex I should be used.,NF
ECSS-E-ST-60-20_0920022,A sensor with the (partial) image download capability shall have the following minimum outputs: 1.	the signal value for each relevant detector element; 2.	the Measurement date. 3.	the integration time (optional).,F
ECSS-E-ST-60-20_0920023,Any use of image compression (e.g. for transmission) shall be documented.,F
ECSS-E-ST-60-20_0920024,The supplier shall specify the number of bits per pixel used to encode the detector image.,NF
ECSS-E-ST-60-20_0920025,The image output time shall be verified by test using the hardware agreed between the customer and supplier.,NF
ECSS-E-ST-60-20_0920026,"A sensor with the sun survivability capability shall withstand direct sun illumination along the bore sight axis, for at least a given period of time agreed with the customer, without subsequent permanent damage.",NF
ECSS-E-ST-60-20_0920027,A sensor with the sun survivability capability shall recover its full quoted performances after the sun aspect angle has become greater than the sun exclusion angle.,NF
ECSS-E-ST-60-20_0920028,A star camera shall include cartography as a minimum capability.,F
ECSS-E-ST-60-20_0920029,A star tracker shall include the following minimum capabilities: 1.	cartography; 2.	star tracking.,F
ECSS-E-ST-60-20_0920030,An autonomous star tracker shall include the following minimum capabilities: 1.	autonomous attitude determination (‘lost in space’ solution); 2.	autonomous attitude tracking (with internal initialization).,F
ECSS-E-ST-60-20_0920031,The supplier shall document whether the autonomous attitude determination capability is repetitively used to achieve the autonomous attitude tracking.,NF
ECSS-E-ST-60-20_0920042,The worst case performances shall be assessed by using the worst-case sensor of the statistical ensemble.,NF
ECSS-E-ST-60-20_0920043,The statistical ensemble shall be characterized and agreed with the customer.,NF
ECSS-E-ST-60-20_0920044,The performances shall be assessed by using the sensor EOL conditions agreed with the customer.,NF
ECSS-E-ST-60-20_0920090,The supplier shall document what type of relativistic correction is performed.,NF
ECSS-E-ST-60-20_0920091,The supplier shall document the maximum error and minimum frequency of the spacecraft velocity provided to the sensor.,NF
ECSS-Q-ST-80_0720001,"The supplier shall ensure that an organizational structure is defined for software development, and that individuals have defined tasks and responsibilities.",PM
ECSS-Q-ST-80_0720002,"The responsibility, the authority and the interrelation of personnel who manage, perform and verify work affecting software quality shall be defined and documented. ",PM
ECSS-Q-ST-80_0720003,"The responsibilities and the interfaces of each organisation, either external or internal, involved in a project shall be defined and documented. ",PM
ECSS-Q-ST-80_0720004,"The delegation of software product assurance tasks by a supplier to a lower level supplier shall be done in a documented and controlled way, with the supplier retaining the responsibility towards the customer. ",PM
ECSS-Q-ST-80_0720005,The supplier shall provide adequate resources to perform the required software product assurance tasks. ,PM
ECSS-Q-ST-80_0720006,Reviews and audits of processes and of products shall be carried out by personnel not directly involved in the work being performed.,PM
ECSS-Q-ST-80_0720007,The supplier shall identify the personnel responsible for software product assurance for the project (SW PA manager/engineer). ,PM
ECSS-Q-ST-80_0720008,"The software product assurance manager/engineer shall     1. report to the project manager (through the project product assurance manager, if any);     2. have organisational authority and independence to propose and maintain a software product assurance programme in accordance with the project software product assurance requirements;     3. have unimpeded access to higher management as necessary to fulfil his/her duties.",PM
ECSS-Q-ST-80_0720009,The supplier shall review the project requirements to establish and make timely provision for acquiring or developing the resources and skills for the management and technical staff. ,PM
ECSS-Q-ST-80_0720039,"The supplier shall establish software product assurance requirements for the next level suppliers, tailored to their role in the project, including a requirement to produce a software product assurance plan. ",M
ECSS-Q-ST-80_0720040,The supplier shall provide the software product assurance requirements applicable to the next level suppliers for customer’s acceptance. ,PM
ECSS-Q-ST-80_0720151,"For the definition of the software related system requirements to be specified in the requirements baseline, ECSS-E-ST-40 clause 5.2 shall apply.",M
ECSS-Q-ST-80_0720152,The requirements baseline shall be subject to documentation control and configuration management as part of the development documentation.,V
